title,company,description,link,listedOn,email,phone,city,region,salary,runDate,jobType,regionName,applyType
"Equipment Preparation Assistant Technician (Upper Hutt, New Zealand)",Zoetis Australia Research & Manufacturing Pty Ltd,"Based in Upper Hutt, the purpose of this role is to support the efficiency & performance of the business through preparation & cleaning of equipment.",https://www.seek.co.nz/job/82115483?type=standard&ref=search-standalone&origin=cardTitle#sol=44eeae7cd608c73091c7e334b48f63d862bc4d8c,24d ago,,,,,,2025-03-13,,Wellington,Quick Apply
Director Corporate Services,Tribe (New Zealand) Limited,Our client is looking for an exceptional leader to fill the pivotal role of Director of Corporate Services,https://www.seek.co.nz/job/82704261?type=standard&ref=search-standalone&origin=cardTitle#sol=024d65c5b9552a6598288cd94f16ae60cd4e303b,1d ago,,,,,,2025-03-13,,Wellington,Quick Apply
Test Discipline Defect Manager,ANZ Bank New Zealand Limited,"Drive defect resolution, ensure software quality, coordinate teams, and implement solutions to enhance efficiency at ANZ",https://www.seek.co.nz/job/82703177?type=promoted&ref=search-standalone&origin=cardTitle#sol=937cb77de376d32d1498372393dacbd9bf4bf951,7d ago,,,,,"$154,619 - $231,929",2025-03-13,,Wellington,Apply
Head of Data & AI,Contact Energy,We're on the hunt for a visionary leader to be the mastermind behind our Data & AI strategy. There is real opportunity here to make an impact!,https://www.seek.co.nz/job/82535405?type=promoted&ref=search-standalone&origin=cardTitle#sol=87512b1ed3b71b1af1d7b7f6ab465dbb68a517f8,3d ago,,,,,"$101,911 - $121,196",2025-03-13,,Wellington,Apply
Marketing Executive,Robert Walters,"Exciting career move! We're hiring a Marketing Executive to help grow NZ's top pleasure & sexual wellness retailer, Adulttoymegastore!",https://www.seek.co.nz/job/82561814?type=standard&ref=search-standalone&origin=cardTitle#sol=d8bad9c3b5e4fc7ed29b6bf4df97ab1d2e2b5d56,3d ago,,,,,Competitive salary & benefits,2025-03-13,,Wellington,Quick Apply
Manager Communications RDCS,"Ministry of Business, Innovation and Employment",Manage a small team of communication professionals and drive the strategic communications objectives of the RDCS Group.,https://www.seek.co.nz/job/82646464?type=standard&ref=search-standalone&origin=cardTitle#sol=6ea47c1032916f583eda2b24ca61686cdf2c76ff,20h ago,,,,,"$74,964 to $113,953",2025-03-13,,Wellington,Apply
Senior Communications Advisor,"Ministry of Business, Innovation and Employment",Support a range of portfolios and functions and turn technical information into something beautiful.,https://www.seek.co.nz/job/82644068?type=standard&ref=search-standalone&origin=cardTitle#sol=5c656ceef218f08bcc2a71f2c7906978c9ee4c64,17d ago,,,,,$85037 - $110k p.a. + 9% superannuation contributi,2025-03-13,,Wellington,Apply
Senior Analyst Developer,FNZ Services (NZ) Limited,"Join us the FinTech decacorn, building your successful career by building the world class software",https://www.seek.co.nz/job/81362101?type=standard&ref=search-standalone&origin=cardTitle#sol=e4e2faf0ca223efc89878c2327b9da8f0377d4f6,2d ago,,,,,"90,000-110,000",2025-03-13,,Wellington,Apply
Marketing Advisor,EarnLearn,An exciting opportunity for an experienced Marketing Advisor!,https://www.seek.co.nz/job/82289103?type=standard&ref=search-standalone&origin=cardTitle#sol=022ca1f2a487ef6280cc071058986578aedd6f18,6d ago,,,,,$80k - $100k p.a. + Room for growth,2025-03-13,,Wellington,Quick Apply
Adviser / Senior Adviser Regulatory and Risk Assurance,Ministry for Primary Industries,Work across the Biosecurity Import & Export directorate to ensure offshore biosecurity risk is managed.,https://www.seek.co.nz/job/82670272?type=standard&ref=search-standalone&origin=cardTitle#sol=bda3158cefd443015134311158bb1cfca851eec3,15d ago,,,,,9% superannuation,2025-03-13,,Wellington,Apply
Communications Advisor - Digital,Natural Hazards Commission - Toka Tū Ake,"Communications Advisor - Digital Natural Hazard Commission - Toka Tū Ake About the role | Mo te mahi We are seeking a dynamic digital communications s",https://www.seek.co.nz/job/82625336?type=standard&ref=search-standalone&origin=cardTitle#sol=954024dcb7a5cd4328e9e1a705a4b7e765316d3d,7d ago,,,,,"$140,000 – $160,000 per year",2025-03-13,,Wellington,Apply
Digital Marketing Advisor,ACC New Zealand,"As the Digital Marketing Advisor, you will Support our digital marketing strategy, enhancing our digital presence, and broader marketing initiatives.",https://www.seek.co.nz/job/82371576?type=standard&ref=search-standalone&origin=cardTitle#sol=e7936dc2440f19010b08b2ddb974b149dc65e025,4d ago,,,,,,2025-03-13,,Wellington,Apply
Data and Reporting Systems Specialist,Likemind,Data and Reporting Systems Specialist for a 12-month fixed term to collaborate with stakeholders to improve data management and analytics,https://www.seek.co.nz/job/82580777?type=standard&ref=search-standalone&origin=cardTitle#sol=cc1fb6b2763137a1b4345e20dab66a357e1988cc,24d ago,,,,,,2025-03-13,,Wellington,Quick Apply
Performance / Monitoring Engineer,Expert360,"We are on the hunt for a Junior - Intermediate level SRE ideally with Splunk , ELK stack and Service Now",https://www.seek.co.nz/job/82641330?type=standard&ref=search-standalone&origin=cardTitle#sol=292b71e426018bd2e0b0545e390af17a32c43612,1d ago,,,,,,2025-03-13,,Wellington,Quick Apply
"Equipment Preparation Assistant Technician (Upper Hutt, New Zealand)",Zoetis Australia Research & Manufacturing Pty Ltd,"Based in Upper Hutt, the purpose of this role is to support the efficiency & performance of the business through preparation & cleaning of equipment.",https://www.seek.co.nz/job/82115483?type=standard&ref=search-standalone&origin=cardTitle#sol=3cd5c97dc241d85a86e9a74f01026b01cfe4a406,14d ago,,,,,,2025-03-13,,Wellington,Quick Apply
Director Corporate Services,Tribe (New Zealand) Limited,Our client is looking for an exceptional leader to fill the pivotal role of Director of Corporate Services,https://www.seek.co.nz/job/82704261?type=standard&ref=search-standalone&origin=cardTitle#sol=4826765b8059e993dbeb39506e9b3ff00c951bbb,1d ago,,,,,,2025-03-13,,Wellington,Quick Apply
Test Lead,ANZ Bank New Zealand Limited,"A pivotal role in the Cards Switching NZ team, responsible for enhancing the banks' card switching services",https://www.seek.co.nz/job/82400661?type=standard&ref=search-standalone&origin=cardTitle#sol=d756c120d682f7d7c6b07a0ca7aff45e7a5b91cf,9d ago,,,,,,2025-03-13,,Wellington,Apply
Senior Digital Marketing Executive,BrightSpark Recruitment,Join a successful full-service agency collaborating with some of New Zealand's most iconic brands,https://www.seek.co.nz/job/82700507?type=standard&ref=search-standalone&origin=cardTitle#sol=1db68b3e7985523c025cdf61ab07c2d42b982cfe,17h ago,,,,,,2025-03-13,,Wellington,Quick Apply
Information Security Consultant,Robert Walters,Our client is seeking a Junior Information Security Consultant to join their team in Wellington with 1-2 years of security experience.,https://www.seek.co.nz/job/82505159?type=standard&ref=search-standalone&origin=cardTitle#sol=a14295e72ddcdff3435ac10907e8dda5684730d5,15d ago,,,,,,2025-03-13,,Wellington,Quick Apply
"Development Delivery Lead | Kaiārahi Hora Whanaketanga",Stats NZ,"Lead transformative initiatives with your technical, project management, and stakeholder skills. Drive impactful business change and innovation!",https://www.seek.co.nz/job/82741793?type=standard&ref=search-standalone&origin=cardTitle#sol=bd12b5a180edf7749b2fdd1ee8d25a9e38b480f9,2d ago,,,,,,2025-03-13,,Wellington,Apply
ICT Business Analyst,WorkSafe New Zealand,Join our Digital Projects team and work on different initiatives with a variety of people across WorkSafe and our suppliers.,https://www.seek.co.nz/job/82369936?type=standard&ref=search-standalone&origin=cardTitle#sol=7f18a6302a947dcd041808e25eb2beab070bb77f,9d ago,,,,,,2025-03-13,,Wellington,Apply
Practice Lead Information Security,ACC New Zealand,Be part of the team driving the way forward in developing and embedding best practice innovation across Technology and Data.,https://www.seek.co.nz/job/82681621?type=standard&ref=search-standalone&origin=cardTitle#sol=df80f14681aa4f7ea6503dcb3222bf522877ac4a,1d ago,,,,,,2025-03-13,,Wellington,Apply
Chief Executive - Part Time,CarbonEES,We are looking for an individual with a passion for sustainability and climate change to lead our small and tightly knit team.,https://www.seek.co.nz/job/82498327?type=standard&ref=search-standalone&origin=cardTitle#sol=b674a04aa78363ed4139795614319c8a4e59da0d,,,,,,,2025-03-13,,Wellington,Quick Apply
Test Discipline Defect Manager,ANZ Bank New Zealand Limited,"Drive defect resolution, ensure software quality, coordinate teams, and implement solutions to enhance efficiency at ANZ",https://www.seek.co.nz/job/82703177?type=standard&ref=search-standalone&origin=cardTitle#sol=0a2c5469d61dddb4cd7fcf0105e5f2644b6c5f58,,,,,,,2025-03-13,,Wellington,Apply
Events & Marketing Manager,Pinot & Picasso,"Pinot and Picasso is a fun, upbeat, creative fast paced environment.",https://www.seek.co.nz/job/82038922?type=standard&ref=search-standalone&origin=cardTitle#sol=f2b8bfe0327214d58c7bb9617e83c755f1aee00f,1mo ago,,,,,"$55,000 – $65,000 per year",2025-03-13,,Wellington,Quick Apply
Point of Care Testing Coordinator – Laboratory,Awanui Group,"Use your laboratory skills in a clinical setting with our part-time, fixed-term position as a Point of Care Testing (POCT) coordinator.",https://www.seek.co.nz/job/82702500?type=standard&ref=search-standalone&origin=cardTitle#sol=3a1b0dae0068f6b665576f9e49a20aba7be50edb,1d ago,,,,,"$117,734 - $146,513",2025-03-13,,Wellington,Apply
Laboratory Technician / Preparation Sampler,Bureau Veritas Australia Pty Ltd,We offer you the opportunity to build your career and give you the recognition you deserve.,https://www.seek.co.nz/job/82529099?type=standard&ref=search-standalone&origin=cardTitle#sol=09b3366463705eeb651000166fff9b31619ae3a6,8d ago,,,,,$110 - $120 p.h. + Hourly rate + paid weekly,2025-03-13,,Wellington,Apply
Project Delivery Manager,Chorus,Ready to take the lead in shaping the future? Join us in managing the full project journey for our copper retirement strategy!,https://www.seek.co.nz/job/82561881?type=standard&ref=search-standalone&origin=cardTitle#sol=27f83e2855524d3bb6e860f4f4b22beab1522241,7d ago,,,,,+Kiwisaver & Health Insurance,2025-03-13,,Wellington,Apply
Communications Specialist,Enlighten Talent,Put your flair for storytelling to good use and make a meaningful impact supporting this charitable organisation realise their potential.,https://www.seek.co.nz/job/82152913?type=standard&ref=search-standalone&origin=cardTitle#sol=486e3637e237653c65e154c0c06f160c534a08b1,23d ago,,,,,Join a business with competitive staff benefits!,2025-03-13,,Wellington,Quick Apply
Trade Communications Manager,DuluxGroup,Looking for a Trade Communications Manager with strong customer acquisition & retention experience to support in our digital transformation journey!,https://www.seek.co.nz/job/82675056?type=standard&ref=search-standalone&origin=cardTitle#sol=c505d90d1a19d97b305865abd3a7ef3bb29cf244,2d ago,,,,,$100000.00 - $105000.00,2025-03-13,,Wellington,Apply
MS Teams/SharePoint Technical Lead,Department of Internal Affairs,We are seeking an experienced Microsoft Teams/SharePoint Online individual.,https://www.seek.co.nz/job/82593778?type=standard&ref=search-standalone&origin=cardTitle#sol=c2c7c8640c6745a335cbf929e993bddd75dc7ac5,7d ago,,,,,Fixed Term until December 2025,2025-03-13,,Wellington,Apply
Test Manager - HRIS project,Expert360,Long term contract opportunity for a Test Manager with experience in Payroll Testing and HRIS replacement projects.,https://www.seek.co.nz/job/82758407?type=standard&ref=search-standalone&origin=cardTitle#sol=5ecea445fe0571fc46277109d05ba493c1862565,2h ago,,,,,AUD 60000 - 70000 per annum (AUD),2025-03-13,,Wellington,Quick Apply
Service Desk Analyst,Spark New Zealand Trading Limited,Service Desk Analyst,https://www.seek.co.nz/job/82468162?type=standard&ref=search-standalone&origin=cardTitle#sol=cac0024217027dc7a21f9e5b85c54062e24ff22d,10d ago,,,,,,2025-03-13,,Wellington,Apply
Technical Business Analyst,UpperGround by Hudson - Projects & Transformation,"Experienced Salesforce Business Analyst needed for a large-scale transformation, working with SaaS tech in an Agile public sector environment",https://www.seek.co.nz/job/82714796?type=standard&ref=search-standalone&origin=cardTitle#sol=6c581fad3aad52c6177f46cd308c4b4eef862ef6,1d ago,,,,,,2025-03-13,,Wellington,Quick Apply
"Product Owner, Intelligence Engagement Systems",Government Communications Security Bureau,"Do you recognise that technology is a means to an end, and that valuable customer outcomes are what matters most?",https://www.seek.co.nz/job/82535168?type=standard&ref=search-standalone&origin=cardTitle#sol=17b645bd040cd535739260292c36d69f223f9606,8d ago,,,,,,2025-03-13,,Wellington,Apply
MarTech Product Lead,ANZ Bank New Zealand Limited,We're seeking a skilled Product Lead to provide key leadership and support critical Marketing Tech functions,https://www.seek.co.nz/job/82607976?type=standard&ref=search-standalone&origin=cardTitle#sol=eae99e061d072392348d48f3b534fa35195a3a01,6d ago,,,,,,2025-03-13,,Wellington,Apply
Field Service Engineer (L2) - Wellington,NTT DATA,Field Services Engineer (L2) is responsible towards a managed service to clients to ensure that their infrastructure remain operational at top notch.,https://www.seek.co.nz/job/82527305?type=standard&ref=search-standalone&origin=cardTitle#sol=3d1a133a49ebfa5cbde38dccfc5f3ef9ecab7c6e,8d ago,,,,,,2025-03-13,,Wellington,Apply
Head of Enterprise Portfolio and Change Management,The Co-operative Bank,Join our small but mighty bank in this new role and lead our Enterprise Portfolio and Change Management function.,https://www.seek.co.nz/job/82666947?type=standard&ref=search-standalone&origin=cardTitle#sol=a9e34c180796a4f3cd16f0b342b06891110a75c0,3d ago,,,,,,2025-03-13,,Wellington,Apply
Software Developer,Taylor Preston Limited,"A skilled .NET Developer with experience in C#, WPF, MAUI, and SQL Server to develop, maintain, and enhance enterprise-grade applications.",https://www.seek.co.nz/job/82730937?type=standard&ref=search-standalone&origin=cardTitle#sol=7735e17db46258e601225fcba39d85672f2bed2f,22h ago,,,,,,2025-03-13,,Wellington,Apply
Application Support Analyst,FNZ Services (NZ) Limited,"This is an exciting opportunity to be a part of a global team. As a Production Support Analyst, you’ll provide application support for our business.",https://www.seek.co.nz/job/82527594?type=standard&ref=search-standalone&origin=cardTitle#sol=841776db48716dba5b7cae974693da81e584368c,8d ago,,,,,,2025-03-13,,Wellington,Apply
Customer Lifecycle Manager,Kiwibank,Create meaningful cross-channel journeys that help our customers with their goals and deliver ROI back to the business.,https://www.seek.co.nz/job/82698205?type=standard&ref=search-standalone&origin=cardTitle#sol=a4221c14c48f9d572d6c1b7665490d5fcabe0b90,2d ago,,,,,,2025-03-13,,Wellington,Apply
Senior Project Manager,Randstad Digital,"Looking for a Business-focused Senior Project Manager with experience in business case authoring, coordinating and implementation planning",https://www.seek.co.nz/job/82733585?type=standard&ref=search-standalone&origin=cardTitle#sol=ecb99dad9b2f2fe10db28193ee4c6fc7afc9e367,21h ago,,,,,,2025-03-13,,Wellington,Apply
Technical Business Analyst (6 Months),Talent Vault Ltd,Urgent Wellington based 6 month Senior BA contract role,https://www.seek.co.nz/job/82679082?type=standard&ref=search-standalone&origin=cardTitle#sol=5bb4dce6e2e018bccdfb2ef32cf59e3264afe6dc,2d ago,,,,,,2025-03-13,,Wellington,Quick Apply
Data Engineer,TSB,"Undertake the development, enhancement and support of the Bank’s data platform.",https://www.seek.co.nz/job/82698978?type=standard&ref=search-standalone&origin=cardTitle#sol=b3e8149ac700bd61f285e423c727a8ce62b8e90a,2d ago,,,,,,2025-03-13,,Wellington,Apply
Database Administrator,BNZ,"Join our collaborative and supportive team environment. We value organisation and mutual support, with a good dose of humour.",https://www.seek.co.nz/job/82604196?type=standard&ref=search-standalone&origin=cardTitle#sol=8f7420da6bbaf57b161cec3ae13053804bfd0415,6d ago,,,,,,2025-03-13,,Wellington,Apply
Field Services Technician – POS Systems,Green Light PS Pty Ltd,Fulltime Permanent Opportunity. Wellington Location. Immediate Start. Excellent Salary and Benefits. Full Onsite Training Provided. Green,https://www.seek.co.nz/job/82186805?type=standard&ref=search-standalone&origin=cardTitle#sol=f2873e1c83d3c253dc8f7e1cb4ba04b79d6cbaaf,22d ago,,,,,,2025-03-13,,Wellington,Quick Apply
Technical Lead,"Ministry of Business, Innovation and Employment",Work in a dynamic environment and play a key role in delivering transformational change,https://www.seek.co.nz/job/82532915?type=standard&ref=search-standalone&origin=cardTitle#sol=6815b814a7e512cdcbf8a61b168f867fafdde85c,8d ago,,,,,"$118,390-$143,639 + Kiwisaver + Wellness Benefits",2025-03-13,,Wellington,Apply
Head of Communications and Government Services,INSIDE Recruitment,"In this role, you will play a pivotal role in ensuring WorkSafe operates effectively as a Crown entity. Role is flexible on location.",https://www.seek.co.nz/job/82423673?type=standard&ref=search-standalone&origin=cardTitle#sol=9294531e8e3e59069f5e5c676c0fce5f322200d7,13d ago,,,,,"$95,972 - $128,391 + KiwiSaver",2025-03-13,,Wellington,Quick Apply
.NET Developer (Junior to Intermediate),GS1 New Zealand,Craving a career-defining role with a genuinely purpose-driven organisation?,https://www.seek.co.nz/job/82181347?type=standard&ref=search-standalone&origin=cardTitle#sol=6a17b9ed5c3ac2de0448a83f13b29c8ccf04a66f,23d ago,,,,,Competitive salary package + outstanding benefits,2025-03-13,,Wellington,Quick Apply
Deputy Chief Executive - People and Operations,Sheffield,"A fantastic role, ensuring we have the people, systems and resources to deliver on our international priorities",https://www.seek.co.nz/job/82700504?type=standard&ref=search-standalone&origin=cardTitle#sol=f39d0da1513b57b147da4cba26df4fbcea709a0e,1d ago,,,,,Base salary + Bonus + Laptop,2025-03-13,,Wellington,Quick Apply
Digital Marketing and Brand Manager,Fiso Group,"Fiso Group is seeking a experienced Digital Marketing & Brand Manager to drive strategy, engagement, and brand growth across a diverse portfolio.",https://www.seek.co.nz/job/82222806?type=standard&ref=search-standalone&origin=cardTitle#sol=385420f2b467d1e5b76b995cb9dcd1f9840e5d3b,21d ago,,,,,"$100,000 - $118,000",2025-03-13,,Wellington,Quick Apply
Application Support Developer,FNZ Services (NZ) Limited,"As an Application Support Developer, you will play a critical role within our Production Support Department.",https://www.seek.co.nz/job/82643570?type=standard&ref=search-standalone&origin=cardTitle#sol=a8e08abdef54477c81bddf3c4f67489626198789,3d ago,,,,,"​$80,000 - $110,000 Base Salary + Benefits",2025-03-13,,Wellington,Apply
"Technical Business Analyst | Kaitātari Pakihi Hangarau Whakawhiti Kōrero",Stats NZ,Play a key part in building and improving information/data services and processes that help us ensure New Zealanders have quality data and statistics.,https://www.seek.co.nz/job/82567959?type=standard&ref=search-standalone&origin=cardTitle#sol=e7ef9ae4dbce0fb3185f131ad5adfc06a207d152,7d ago,,,,,Competitive salary package + outstanding benefits,2025-03-13,,Wellington,Apply
IT Coordinator,TEKsystems,Passionate about digital transformation? This role lets you drive impact in metering operations with strong organization and attention to detail.,https://www.seek.co.nz/job/82479519?type=standard&ref=search-standalone&origin=cardTitle#sol=92a7f64e8bc12cd3f1c990d3d94dc8251ee60cb5,10d ago,,,,,Competitive salary package + outstanding benefits,2025-03-13,,Wellington,Apply
Technology Governance Analyst,Kiwibank,Help support the implementation of internal standards and practices for Technology Governance within our Digital and Technology Team at Kiwibank.,https://www.seek.co.nz/job/82568782?type=standard&ref=search-standalone&origin=cardTitle#sol=ee3eb664d06559d24ff4929e55d9c7fd06897408,7d ago,,,,,NZD 35 - 40 per hour,2025-03-13,,Wellington,Apply
IT Manager - Join a Leading Property Insights Business,Quotable Value Limited,We're looking for an experienced IT Manager to oversee critical technology services and help drive innovation within our team.,https://www.seek.co.nz/job/82319089?type=standard&ref=search-standalone&origin=cardTitle#sol=c0268400b673ff78af2f7aa021d0208c5de24e20,17d ago,,,,,12-month Fixed Term covering Parental Leave,2025-03-13,,Wellington,Apply
Lead Data Engineer,Westpac New Zealand Limited,We are looking for a seasoned lead data engineer to join in our team.,https://www.seek.co.nz/job/82698878?type=standard&ref=search-standalone&origin=cardTitle#sol=a2939bda0cce779f33ed175169e39803dbc35fce,2d ago,,,,,"$75,000 – $95,000 per year",2025-03-13,,Wellington,Apply
Media and Content Manager,Chorus,"Leverage your media expertise and exec collaboration to secure coverage, align messaging, and drive our purpose-driven strategy!",https://www.seek.co.nz/job/82561556?type=standard&ref=search-standalone&origin=cardTitle#sol=929eb21162587a41679469d0186f2a577b1a8e62,7d ago,,,,,,2025-03-13,,Wellington,Apply
Communications Manager,"Talent – Specialists in tech, transformation & beyond",A unique opportunity has emerged to join Te Tumu Paeroa at a critical time as they build and grow their communications function.,https://www.seek.co.nz/job/82699512?type=standard&ref=search-standalone&origin=cardTitle#sol=d49927aa0d9171151d98f8a5b95233d810898abd,2d ago,,,,,,2025-03-13,,Wellington,Quick Apply
"Communications, PR & Engagement Manager",Likemind,"Communications, PR, and Engagement Manager for a 12-month fixed term to elevate their brand, to further strengthen key relationships.",https://www.seek.co.nz/job/82182401?type=standard&ref=search-standalone&origin=cardTitle#sol=1b9e200c2429ccb2061f1919cb59465f03e291b9,22d ago,,,,,,2025-03-13,,Wellington,Quick Apply
Operations Support Officer - Manufacturing,NZ Blood Service,Are you an experienced Medical Laboratory Scientist or Technician with a passion in leading process improvement?,https://www.seek.co.nz/job/82016318?type=standard&ref=search-standalone&origin=cardTitle#sol=ffed62011f949b7dcee9d8171c1e4518a1956a6d,1mo ago,,,,,,2025-03-13,,Wellington,Apply
​​Digital Marketing Manager​,Campfire Digital Recruitment,"​​Drive high-impact digital campaigns and work with great clients, at a great company with an even greater team culture.​",https://www.seek.co.nz/job/82406950?type=standard&ref=search-standalone&origin=cardTitle#sol=be718c107fc797915c7bc6787ad1284cb5439b31,14d ago,,,,,,2025-03-13,,Wellington,Quick Apply
Product Lead - Modern Workplace,Kiwibank,Our Digital Workplace team is looking for a Product Lead who will help us create unbeatable employee and team experiences,https://www.seek.co.nz/job/82728518?type=standard&ref=search-standalone&origin=cardTitle#sol=b5cf2b1aff90621497a07b09a6a26df55233453a,1d ago,,,,,,2025-03-13,,Wellington,Apply
Performance Insights and Modelling Specialist,KiwiRail,Join us as a Performance Insights and Modelling Specialist and help shape the future of rail asset management in New Zealand.,https://www.seek.co.nz/job/82705401?type=standard&ref=search-standalone&origin=cardTitle#sol=cfa950ffe8020ac0ee0be1f3c57aee9d215fa355,1d ago,,,,,,2025-03-13,,Wellington,Apply
Principal Architect - Integration,Kiwibank,"Seeking a Principal Architect for integration, supporting current state whilst enabling the transition to a modern integration technology approach.",https://www.seek.co.nz/job/82739596?type=standard&ref=search-standalone&origin=cardTitle#sol=19a9e43c12012dee42b2d6db06a02593b37ab42a,18h ago,,,,,,2025-03-13,,Wellington,Apply
Field Services Technician – POS Systems,Green Light PS Pty Ltd,Contract Opportunity. Wellington Location. Immediate Start. Excellent Hourly Rate. Full Onsite Training Provided. Green Light Worldwide,https://www.seek.co.nz/job/82188606?type=standard&ref=search-standalone&origin=cardTitle#sol=78a52960a8598b4eff8b937e9dfb9dda99eeb711,22d ago,,,,,,2025-03-13,,Wellington,Quick Apply
Performance and Operations Lead,Kiwibank,"Streamline processes, manage budgets, & enhance ways of working while driving strategic planning, performance measurement, & marketing optimisation.",https://www.seek.co.nz/job/82602730?type=standard&ref=search-standalone&origin=cardTitle#sol=56f8c277d7cbc17f5876bb7c2cea56fc2679b711,6d ago,,,,,,2025-03-13,,Wellington,Apply
"Kaitohutohu Rautaki Kōrero | Communications Advisor",Te Taura Whiri i te reo Māori,Te Taura Whiri is seeking a Communications Advisor. Join us in promoting te reo Māori as a living language. Fixed Term for six months.,https://www.seek.co.nz/job/82677845?type=standard&ref=search-standalone&origin=cardTitle#sol=617815b031a263951dc6ab54757e2c4017faf3ef,2d ago,,,,,,2025-03-13,,Wellington,Quick Apply
Software Engineer,Absolute IT Limited,Join a public sector programme building a new Greenfields platform.,https://www.seek.co.nz/job/82700235?type=standard&ref=search-standalone&origin=cardTitle#sol=957645cf916fe0f30a487091f36bcdfa86b83375,2d ago,,,,,"$120,000 – $160,000 per year",2025-03-13,,Wellington,Quick Apply
General Manager,Reveal Infrastructure Limited,"A key leadership role that will shape Reveal’s future, ensuring short-term performance, sustainable growth and a strong market presence.",https://www.seek.co.nz/job/82390810?type=standard&ref=search-standalone&origin=cardTitle#sol=95869d975e6bd5a4f9f639e2445c5ace7d7983af,15d ago,,,,,"$150,000 – $180,000 per year",2025-03-13,,Wellington,Quick Apply
