title,company,description,link,listedOn,email,phone,city,region,salary,runDate,jobType,regionName,applyType
Regional Manager - Dunedin,Profile Group,A leadership opportunity to oversee a well-established trade services operation in Dunedin,https://www.seek.co.nz/job/82682261?type=standard&ref=search-standalone&origin=cardTitle#sol=f1b8aef6bb0d8b949a85ccb7968270e397448acf,17d ago,,,,,,2025-03-13,,Wellington,Quick Apply
Project Manager,Department of Internal Affairs,If you thrive on cutting edge projects and a genuine challenge we would very much like to hear from you.,https://www.seek.co.nz/job/82492730?type=standard&ref=search-standalone&origin=cardTitle#sol=160f2962690f69881d200e3d3fe545d11cf3b928,24d ago,,,,,,2025-03-13,,Wellington,Apply
Customer Relationship Manager - HCM,Fusion5,We are looking for a service delivery professional based in our Wellington office!,https://www.seek.co.nz/job/82318771?type=standard&ref=search-standalone&origin=cardTitle#sol=1ada4738b221a07d0b6ecc6b8a6f6b5f1e24c7fb,1d ago,,,,,,2025-03-13,,Wellington,Quick Apply
Senior Data Engineer - Hawke's Bay Location,Pipeline Recruitment,Play a key role in leading the data transformation journey at Unison Networks. Exciting career opportunity; Hawke's Bay location.,https://www.seek.co.nz/job/82141592?type=standard&ref=search-standalone&origin=cardTitle#sol=4d2bd18c838835d6aab32005b9f6f86ab5b1f0e5,8d ago,,,,,,2025-03-13,,Wellington,Quick Apply
Senior Business Analyst,Natural Hazards Commission - Toka Tū Ake,"Natural Hazard Commission - Toka Tū Ake About the role | Mo te mahi We're on a journey to grow our business analysis team in the information and digit",https://www.seek.co.nz/job/82728808?type=standard&ref=search-standalone&origin=cardTitle#sol=fa8c14dc8e4292b0bd22408c6fecb75206ee0982,23d ago,,,,,,2025-03-13,,Wellington,Apply
Programme Architect,"Ministry of Business, Innovation and Employment",Discover a career with purpose at MBIE,https://www.seek.co.nz/job/82538378?type=standard&ref=search-standalone&origin=cardTitle#sol=a9fd57111a6d92805dc1436f0b9454ea3b30a063,10d ago,,,,,,2025-03-13,,Wellington,Apply
Data and Reporting Systems Manager,Likemind,"Seeking a Data and Reporting Systems Manager for a 12-month fixed term to collaborate with stakeholders, to deliver innovative solutions.",https://www.seek.co.nz/job/82182343?type=standard&ref=search-standalone&origin=cardTitle#sol=d0cbf880d9c456ec49554a958e060bab8429d9a6,16d ago,,,,,,2025-03-13,,Wellington,Quick Apply
Senior Project Manager,Talent Vault Ltd,Senior PM Manager.Focus and experience on delivering of detailed design through to implementation.,https://www.seek.co.nz/job/82468621?type=standard&ref=search-standalone&origin=cardTitle#sol=f00d67bcb4634460687ee8e108f088df77a45f20,1mo ago,,,,,,2025-03-13,,Wellington,Quick Apply
CRM Data Coordinator,Arvida Limited,Join our purpose-driven organisation as our CRM Coordinator and showcase your customer service and team management skills,https://www.seek.co.nz/job/82340473?type=standard&ref=search-standalone&origin=cardTitle#sol=60348f3d222864bb4c553a28e31589a0ea968658,2d ago,,,,,,2025-03-13,,Wellington,Apply
Content Marketing Manager,H2R Technology Limited,Join Volpara Health as a Content Marketing Manager to drive brand awareness that engages audiences and supports business growth,https://www.seek.co.nz/job/82013098?type=standard&ref=search-standalone&origin=cardTitle#sol=a5a2d4378e1551e48806f1dc48cc9ed1b272959d,3d ago,,,,,,2025-03-13,,Wellington,Apply
Integration Developer,Kainga Ora,"Modernising integration platform, you will be focused on continuous improvement in the development and delivery of integration solutions.",https://www.seek.co.nz/job/82681890?type=standard&ref=search-standalone&origin=cardTitle#sol=f8bd3b434673a77d4cb2033e6449cfdf0853994f,18d ago,,,,,,2025-03-13,,Wellington,Apply
Functional Consultant - Microsoft Dynamics 365 CE,DXC Technology Australia & New Zealand,Exciting time to join DXC with strategic account wins and new projects commencing that offer a lot of variety with a range of tech across platforms.,https://www.seek.co.nz/job/82646029?type=standard&ref=search-standalone&origin=cardTitle#sol=5f3fa8e61f860ddcea616474110fb23683259e63,14d ago,,,,,,2025-03-13,,Wellington,Quick Apply
Fullstack Developer,Starfish Consulting,Fullstack Developer,https://www.seek.co.nz/job/82288503?type=standard&ref=search-standalone&origin=cardTitle#sol=8e8e62f1680dcf1f7b2a76db7000fdb97f559f5d,,,,,,,2025-03-13,,Wellington,Quick Apply
Senior Project Manager,Absolute IT Limited,Opportunity for a seasoned project manager to complete a key SharePoint implementation.,https://www.seek.co.nz/job/82400852?type=standard&ref=search-standalone&origin=cardTitle#sol=d6d0273e7391f1941519951d61d6477624887b6f,,,,,,,2025-03-13,,Wellington,Quick Apply
Business Development and Marketing Advisor,Volunteer Service Abroad (VSA),Unique opportunity to help strengthen our partner's business strategies and build capacity.,https://www.seek.co.nz/job/82494284?type=standard&ref=search-standalone&origin=cardTitle#sol=03ddfaad012778c1636b7ec275df1a689cca7c04,9d ago,,,,,"$80,000 – $90,000 per year",2025-03-13,,Wellington,Apply
Executive Director,Sheffield,"Lead NZ’s private surgical healthcare—drive strategy, advocacy, and excellence as NZPSHA Executive Director.",https://www.seek.co.nz/job/82288980?type=standard&ref=search-standalone&origin=cardTitle#sol=e85c81a34f51f32af6cbfd50a57b6a493f73b13c,18d ago,,,,,Competitive Salary.,2025-03-13,,Wellington,Quick Apply
Penetration Tester,Bastion Security Group,An exciting opportunity to take the next step in your cybersecurity career.,https://www.seek.co.nz/job/82067814?type=standard&ref=search-standalone&origin=cardTitle#sol=a0b9cdcd1b9de3af914d7d02177d667a10c922e4,1mo ago,,,,,Max $82.50 per hour,2025-03-13,,Wellington,Quick Apply
Lighting Controls Specialist,Intelligent Environments Ltd,"An opportunity for a collaborative, smart, tech-savvy established lighting controls specialist who wants to continue to grow their career.",https://www.seek.co.nz/job/82038640?type=standard&ref=search-standalone&origin=cardTitle#sol=3db79ec5c334351b67f4fe62d6b5534e7dad59d5,1mo ago,,,,,Auckland based,2025-03-13,,Wellington,Quick Apply
Senior Test Analyst - Fraud,Capgemini Australia Pty Ltd,Are you a Senior Test Analyst with experience in the Banking sector and worked on Fraud Project Initiatives? Read on!,https://www.seek.co.nz/job/82673608?type=standard&ref=search-standalone&origin=cardTitle#sol=d2a31c88fcc7d5b1498e9575ad57f2fc2744a73b,2d ago,,,,,"Salary up to $135,000 p.a.",2025-03-13,,Wellington,Apply
Senior Software Engineer,Beyond Recruitment - NZ’s best career opportunities – jobs all over Aotearoa,"Domain knowledge in banking and experience in back-end development of API’s, building Node JS, Microservices, Integration and CI/CD pipelines.",https://www.seek.co.nz/job/82703152?type=standard&ref=search-standalone&origin=cardTitle#sol=4578264a608a2bec821b51a149daf10f3dbf695f,1d ago,,,,,"$104,027 – $121,657 + Superannuation",2025-03-13,,Wellington,Quick Apply
Senior Full Stack Developer,"Hays | Technology",3-MONTH CONTRACT - WELLINGTON BASED,https://www.seek.co.nz/job/82729208?type=standard&ref=search-standalone&origin=cardTitle#sol=3484df03d5d2b6d977dc90e108a4f6cbb1698857,1d ago,,,,,,2025-03-13,,Wellington,Quick Apply
"Snr Project Coordinator, Wgtn, 12m, Contract, Financial sector",Find IT Recruitment,We are seeking a Senior Project Coordinator on contract for 12m starting mid March 2025. Financial services experience sought...,https://www.seek.co.nz/job/82288590?type=standard&ref=search-standalone&origin=cardTitle#sol=9c410ad102c46d45d804481a99d2d502500ff06d,18d ago,,,,,,2025-03-13,,Wellington,Quick Apply
DevOps/ Platform Engineer,Find IT Recruitment,Play a key part in optimising and maintaining our client's infrastructure in this exciting DevOps contract role.,https://www.seek.co.nz/job/82383295?type=standard&ref=search-standalone&origin=cardTitle#sol=2097a7ba4ca412643b899fa396e6acc533e55065,15d ago,,,,,,2025-03-13,,Wellington,Quick Apply
Data Modeller,Beyond Recruitment - NZ’s best career opportunities – jobs all over Aotearoa,Data Modeller Data Warehouse Data Analyst Data Design,https://www.seek.co.nz/job/82422406?type=standard&ref=search-standalone&origin=cardTitle#sol=bb09b1775b3776d3a02e4b71d5bc60cc59e9009b,14d ago,,,,,,2025-03-13,,Wellington,Quick Apply
Chief Executive Officer,Brannigans Consulting Limited,"Lead the development and implementation of organisational structure, business planning and strategies.",https://www.seek.co.nz/job/82015683?type=standard&ref=search-standalone&origin=cardTitle#sol=0f74a5893c60107f9f74aba70fb4e5c101a6732f,1mo ago,,,,,,2025-03-13,,Wellington,Quick Apply
Senior Database Administrator,BNZ,Newly created senior opportunity where you will be helping to build a motivated team while guiding the direction of BNZs future database solutions.,https://www.seek.co.nz/job/82593193?type=standard&ref=search-standalone&origin=cardTitle#sol=bab904ae345f41998bf97553a853a1b15abf3c4a,7d ago,,,,,,2025-03-13,,Wellington,Apply
Senior Business Analyst,Absolute IT Limited,Drive business and technical analysis in a critical project,https://www.seek.co.nz/job/82728477?type=standard&ref=search-standalone&origin=cardTitle#sol=9654b8def8c6e2e471887394d127c9ef9c402227,1d ago,,,,,,2025-03-13,,Wellington,Quick Apply
Lead Process Designers,Momentum Consulting Group,We are looking for Lean Six Sigma qualified Lead Business Designers to develop a business process improvement roadmap.,https://www.seek.co.nz/job/82669051?type=standard&ref=search-standalone&origin=cardTitle#sol=37575a46249f36098f99a0aa8fc43dec9659fb3d,3d ago,,,,,,2025-03-13,,Wellington,Quick Apply
Proposition Lead,Chorus,"We're looking for someone innovative to guide the development and execution of customer value propositions, product changes, & exciting launches.",https://www.seek.co.nz/job/82559248?type=standard&ref=search-standalone&origin=cardTitle#sol=2afce5b69b29164e7ab88af10e056f1d0bf65b70,8d ago,,,,,,2025-03-13,,Wellington,Apply
Test Manager,TEKsystems,We are looking for an experienced Test Manager to lead testing for a large-scale Cloud Migration project.,https://www.seek.co.nz/job/82551380?type=standard&ref=search-standalone&origin=cardTitle#sol=b6895678e6d24f4dc2130cbb09a21bd4d373ca90,8d ago,,,,,,2025-03-13,,Wellington,Apply
Project Scheduler,Comspek International Limited,We are seeking a skilled Project Scheduler with expertise in MS Project to join our client's dynamic team,https://www.seek.co.nz/job/82302779?type=standard&ref=search-standalone&origin=cardTitle#sol=504b1de05214925e185d45c62b38debc1abd78e7,17d ago,,,,,,2025-03-13,,Wellington,Quick Apply
Cybersecurity Threat Intelligence Analyst,Datacom,.Datacom works with organisations and communities across Australia and New Zealand to make a difference in people’s lives,https://www.seek.co.nz/job/82507291?type=standard&ref=search-standalone&origin=cardTitle#sol=34b4fa8285995b6691499a7ba7e00cdb6ff43afe,9d ago,,,,,,2025-03-13,,Wellington,Quick Apply
Engineer - Cloud,Find IT Recruitment,Join a fast-growing organisation in financial services - great opportunity to progress your career!,https://www.seek.co.nz/job/82072891?type=standard&ref=search-standalone&origin=cardTitle#sol=a299443be3d5c959c75eadbc31a321bd7e5aafc3,27d ago,,,,,,2025-03-13,,Wellington,Quick Apply
"Statistical Production Lead | Kaihautū Hanga Tatauranga",Stats NZ,Drive the successful coordination of statistical releases and ensure efficient delivery of statistical products that make a real impact in Aotearoa.,https://www.seek.co.nz/job/82593757?type=standard&ref=search-standalone&origin=cardTitle#sol=2174a5205cd42cbeee33e6757e48c49e19327e59,7d ago,,,,,,2025-03-13,,Wellington,Apply
Solutions Architect,TEKsystems,If you are a solution focused professional looking to take on a challenging and rewarding contract role we would love to hear from you,https://www.seek.co.nz/job/82524024?type=standard&ref=search-standalone&origin=cardTitle#sol=57e8a078c1245edf4650a399ae5238200cd1ee3a,9d ago,,,,,,2025-03-13,,Wellington,Apply
Full Stack Developer - Relocate to Dunedin,Crescent Consulting,This is an exciting opportunity to play a key role in delivering software solutions within a high-performing development team.,https://www.seek.co.nz/job/82422846?type=standard&ref=search-standalone&origin=cardTitle#sol=9070be61b05edd025490a3cc3b53a10c22fff361,13d ago,,,,,,2025-03-13,,Wellington,Quick Apply
x2 Senior Engineers,Beyond Recruitment - NZ’s best career opportunities – jobs all over Aotearoa,Senior Engineers IT Engineers Software Engineers,https://www.seek.co.nz/job/82500487?type=standard&ref=search-standalone&origin=cardTitle#sol=dd8bdc8915c13d6b5de95c871b9d13e66b2a0748,9d ago,,,,,Competitive salary - flexible working options,2025-03-13,,Wellington,Quick Apply
Engineer - Network,Find IT Recruitment,Great opportunity to take the next step in your career with this fast growing financial services business!,https://www.seek.co.nz/job/82073360?type=standard&ref=search-standalone&origin=cardTitle#sol=448e4e08810f9463500913c2f86a8a9031d24537,27d ago,,,,,Up to $120 p.h.,2025-03-13,,Wellington,Quick Apply
Software Engineer – Mobile Apps - Android,TSB,"Develop and prepare mobile applications and code changes for deployment through testing and production environments, aligned to business needs.",https://www.seek.co.nz/job/82697618?type=standard&ref=search-standalone&origin=cardTitle#sol=7a6f7784621abf429ff9cada6732edbefe1a4bb2,2d ago,,,,,$150k - $180k p.a.,2025-03-13,,Wellington,Apply
DFIR Senior/Lead Incident Responder,Bastion Security Group,Join our growing DFIR team to help us provide exceptional digital forensics and incident response services to our clients.,https://www.seek.co.nz/job/82734084?type=standard&ref=search-standalone&origin=cardTitle#sol=0a108900dbc50da32ef61ecefaf8685f066a5307,20h ago,,,,,Competitive salary package + outstanding benefits,2025-03-13,,Wellington,Quick Apply
Senior Data Analyst  Kaitātari Raraunga Matua,Te Mātāwai,"The role leads the design and development of data sourcing processes, procedures and systems, as well as the go to person in data analytics",https://www.seek.co.nz/job/82559213?type=standard&ref=search-standalone&origin=cardTitle#sol=1c742d15a48712f062f1cc22c035f1079e5ead92,8d ago,,,,,Base + Kiwisaver + Benefits,2025-03-13,,Wellington,Quick Apply
Senior Project Manager,Randstad Digital,Looking at hiring a Senior Project Manager for our Financial Services client,https://www.seek.co.nz/job/82492766?type=standard&ref=search-standalone&origin=cardTitle#sol=acdb2545b906b5275d6c0d06f864385b69de17eb,10d ago,,,,,"$100,000 – $130,000 per year (+Share Options)",2025-03-13,,Wellington,Apply
Senior Applications Developer,New Zealand Customs Service,"Got a passion for crafting and supporting resilient, adaptable systems in an evolving operating environment? Come join us at NZ Customs!",https://www.seek.co.nz/job/82560324?type=standard&ref=search-standalone&origin=cardTitle#sol=239528dafa85bbc28c521c42fffd36f608b10d46,8d ago,,,,,"$120,000 – $135,000 per year +Health+Dental+WFH+",2025-03-13,,Wellington,Apply
Data Architect & ML Lead,Cucumber Limited,"Lead big data architecture, MLOps, and data management solutions. Build scalable, impactful systems for real-world challenges.",https://www.seek.co.nz/job/82492840?type=standard&ref=search-standalone&origin=cardTitle#sol=28e9a4e5ca062cdf02ae361b3468bddec621333b,10d ago,,,,,$110 - $125 p.h.,2025-03-13,,Wellington,Quick Apply
GIS Software Engineer,"Hays | Technology",We are seeking a highly skilled GIS Software Engineer for a 6-month contract in Wellington. The ideal candidate will have extensive experience with FM,https://www.seek.co.nz/job/82678720?type=standard&ref=search-standalone&origin=cardTitle#sol=57171f4486a012da83e5e95de509f1a081920a5e,2d ago,,,,,,2025-03-13,,Wellington,Quick Apply
Senior Laboratory Technician,DOWNER NZ,Great opportunity to join an industry leader as Senior Laboratory Technician! Valid KTP signatory required.,https://www.seek.co.nz/job/82318661?type=standard&ref=search-standalone&origin=cardTitle#sol=e3c24ff706698e597225b67821e1b38b91042f4c,17d ago,,,,,,2025-03-13,,Wellington,Apply
DevOps Lead,Randstad Digital,We are looking for an experienced DevOps Lead to join our clients team,https://www.seek.co.nz/job/82181135?type=standard&ref=search-standalone&origin=cardTitle#sol=4c1da962f2d76271ffa7eecb4d86b8f50a8f020d,23d ago,,,,,,2025-03-13,,Wellington,Apply
Snr Apps Support Specialist SAP/Kronos,New Zealand Police,Snr Apps Support Specialist SAP/Kronos,https://www.seek.co.nz/job/82599154?type=standard&ref=search-standalone&origin=cardTitle#sol=9d1a9b54212c06c6ca6d16f990e618a7f1d7e5ae,6d ago,,,,,,2025-03-13,,Wellington,Apply
Fullstack Developer - FinTech Innovation (Fully Remote in NZ),H2R Technology Limited,"Full Stack Developer | Build modern web apps with Vue.js 3, Python & BFF services in a 100% remote FinTech role. Join a fast-growing, innovative team!",https://www.seek.co.nz/job/82111804?type=standard&ref=search-standalone&origin=cardTitle#sol=0b6f9064dc7d71921741dfa565f654e106e08e57,25d ago,,,,,,2025-03-13,,Wellington,Apply
Senior Software Engineer - API,Kiwibank,Looking for a talented Senior .Net C# Software Engineer to lead the design and development of enterprise-grade APIs on our brand-new cloud platform.,https://www.seek.co.nz/job/82699134?type=standard&ref=search-standalone&origin=cardTitle#sol=edb02fa46072da72f08fd91b26c57f2b965fd249,2d ago,,,,,,2025-03-13,,Wellington,Apply
Stakeholder Engagement Lead (x2),Transpower,"Use your understanding of Te Ao Māori, planning, relationship management and influencing skills to enable the energy future for Aotearoa!",https://www.seek.co.nz/job/82527445?type=standard&ref=search-standalone&origin=cardTitle#sol=119c015a5c806f4369d39b183766391375261f6b,8d ago,,,,,,2025-03-13,,Wellington,Apply
"Kaihautū Mātaitanga | Test Manager",Te Tumu Paeroa,Are you passionate about ensuring software quality and reliability? We are seeking a dynamic Test Manager with excellent stakeholder management skills,https://www.seek.co.nz/job/82560765?type=standard&ref=search-standalone&origin=cardTitle#sol=3b8af14d85d2b01d1b54f7cdc48ec004ff26ecaf,7d ago,,,,,,2025-03-13,,Wellington,Quick Apply
.NET Full Stack Developer,Comspek International Limited,Come join a growing business doing great things. Brand new .NET Full Stack Developer roles in a mature organisation with a start-up feel.,https://www.seek.co.nz/job/82466740?type=standard&ref=search-standalone&origin=cardTitle#sol=3da95cf22b454272fece157a6393650d5f2639eb,11d ago,,,,,,2025-03-13,,Wellington,Quick Apply
Senior Data Analyst,Cubic Transportation Systems,The Senior Data Analyst plays a key role in providing analytical insights and developing reporting solutions to support strategic business decisions.,https://www.seek.co.nz/job/82119612?type=standard&ref=search-standalone&origin=cardTitle#sol=006f0a45e6fd3ba9c66e3af87a2165ec8a9d4ade,24d ago,,,,,,2025-03-13,,Wellington,Quick Apply
Senior Cloud Ops Engineer,New Zealand Customs Service,This is a key role in providing Cloud Operations practice leadership whilst building and supporting platforms and services.,https://www.seek.co.nz/job/82422056?type=standard&ref=search-standalone&origin=cardTitle#sol=5749b2df24422dcf39bcf9d11f4c75fe9a7a307d,14d ago,,,,,,2025-03-13,,Wellington,Apply
Data Discovery Solutions and UX Lead,Noted,"An opportunity to deliver a world class client management solution across Aotearoa and be part of a progressive, community focussed company.",https://www.seek.co.nz/job/82245143?type=standard&ref=search-standalone&origin=cardTitle#sol=a5fee8c3373b9e8d0c94dd35a189eff551e4b1ad,20d ago,,,,,,2025-03-13,,Wellington,Quick Apply
Senior .NET Developer,placeMe IT Recruitment,"Senior role in a smart team of experienced, engineer-minded Developers in a global business offering you full health and dental cover and flex WFH",https://www.seek.co.nz/job/82561628?type=standard&ref=search-standalone&origin=cardTitle#sol=e3b1755f6a52976a0f9d7ddd4be1ba0f8a6d050b,7d ago,,,,,,2025-03-13,,Wellington,Quick Apply
Software Developer - Enterprise Payment Systems.,Tenth Revolution Group,We are looking for a skilled IT Payments Developer/Consultant with expertise in Universal Payment Framework (UPF) and Enterprise Payment Systems.,https://www.seek.co.nz/job/82082686?type=standard&ref=search-standalone&origin=cardTitle#sol=74718287e8e38067b62d061975481891d4f1b66b,27d ago,,,,,,2025-03-13,,Wellington,Quick Apply
Senior Hazmat Consultant (Asbestos & Occupational Hygiene),Precise Limited,Opportunity to work in Wellington with a well established company involved in various aspects of managing hazardous environments.,https://www.seek.co.nz/job/82358619?type=promoted&ref=search-standalone&origin=cardTitle#sol=e76dcb02c635ab7a91031477c25d3a239c9930ba,1d ago,,,,,"Salary up to $135,000 p.a.",2025-03-13,,Wellington,Quick Apply
Senior Technical Consultant - Dynamics 365 CE,DXC Technology Australia & New Zealand,Exciting time to join DXC with strategic account wins and new projects commencing that offer a lot of variety with a range of tech across platforms.,https://www.seek.co.nz/job/82648513?type=promoted&ref=search-standalone&origin=cardTitle#sol=c7e67a4bbb1e5ec883cd13d72c8e45082f18e566,3d ago,,,,,"$104,027 – $121,657 + Superannuation",2025-03-13,,Wellington,Quick Apply
Senior Business Analyst,Absolute IT Limited,Drive business and technical analysis in a critical project,https://www.seek.co.nz/job/82728477?type=standard&ref=search-standalone&origin=cardTitle#sol=10d48c961eaba93d3e0b7def1808dda17b3de220,8d ago,,,,,Up to $120 p.h.,2025-03-13,,Wellington,Quick Apply
Lead Process Designers,Momentum Consulting Group,We are looking for Lean Six Sigma qualified Lead Business Designers to develop a business process improvement roadmap.,https://www.seek.co.nz/job/82669051?type=standard&ref=search-standalone&origin=cardTitle#sol=1ba65114f3e794adec5645a6ff90f6b8f00e54c2,8d ago,,,,,$150k - $180k p.a.,2025-03-13,,Wellington,Quick Apply
Proposition Lead,Chorus,"We're looking for someone innovative to guide the development and execution of customer value propositions, product changes, & exciting launches.",https://www.seek.co.nz/job/82559248?type=standard&ref=search-standalone&origin=cardTitle#sol=f99c4c0bdd6fc094dc85295ce22701d368594052,17d ago,,,,,,2025-03-13,,Wellington,Apply
Test Manager,TEKsystems,We are looking for an experienced Test Manager to lead testing for a large-scale Cloud Migration project.,https://www.seek.co.nz/job/82551380?type=standard&ref=search-standalone&origin=cardTitle#sol=4bddad4159b007d522f546be3a91d043d049a483,9d ago,,,,,,2025-03-13,,Wellington,Apply
Project Scheduler,Comspek International Limited,We are seeking a skilled Project Scheduler with expertise in MS Project to join our client's dynamic team,https://www.seek.co.nz/job/82302779?type=standard&ref=search-standalone&origin=cardTitle#sol=a65b832992eb8f43740b14ef471af2317a367490,27d ago,,,,,,2025-03-13,,Wellington,Quick Apply
Cybersecurity Threat Intelligence Analyst,Datacom,.Datacom works with organisations and communities across Australia and New Zealand to make a difference in people’s lives,https://www.seek.co.nz/job/82507291?type=standard&ref=search-standalone&origin=cardTitle#sol=d710fe0374745f633bdd2671fef0f624c8e3a263,7d ago,,,,,,2025-03-13,,Wellington,Quick Apply
Engineer - Cloud,Find IT Recruitment,Join a fast-growing organisation in financial services - great opportunity to progress your career!,https://www.seek.co.nz/job/82072891?type=standard&ref=search-standalone&origin=cardTitle#sol=accefa2ddc0f4e2e945c4ca0597c1b397c8a29c2,9d ago,,,,,,2025-03-13,,Wellington,Quick Apply
"Statistical Production Lead | Kaihautū Hanga Tatauranga",Stats NZ,Drive the successful coordination of statistical releases and ensure efficient delivery of statistical products that make a real impact in Aotearoa.,https://www.seek.co.nz/job/82593757?type=standard&ref=search-standalone&origin=cardTitle#sol=82a87cf9f073337253356a2faf81676d1f328a41,13d ago,,,,,,2025-03-13,,Wellington,Apply
Solutions Architect,TEKsystems,If you are a solution focused professional looking to take on a challenging and rewarding contract role we would love to hear from you,https://www.seek.co.nz/job/82524024?type=standard&ref=search-standalone&origin=cardTitle#sol=5c38af7b78972c1e23a0f871a2abdae598d44f06,9d ago,,,,,,2025-03-13,,Wellington,Apply
Full Stack Developer - Relocate to Dunedin,Crescent Consulting,This is an exciting opportunity to play a key role in delivering software solutions within a high-performing development team.,https://www.seek.co.nz/job/82422846?type=standard&ref=search-standalone&origin=cardTitle#sol=3213033bdf9f5ada65a9e80c0b72fb47a2057245,27d ago,,,,,,2025-03-13,,Wellington,Quick Apply
x2 Senior Engineers,Beyond Recruitment - NZ’s best career opportunities – jobs all over Aotearoa,Senior Engineers IT Engineers Software Engineers,https://www.seek.co.nz/job/82500487?type=standard&ref=search-standalone&origin=cardTitle#sol=d8afb2eee4c675b253357735e34f3219a0cb8826,2d ago,,,,,,2025-03-13,,Wellington,Quick Apply
Engineer - Network,Find IT Recruitment,Great opportunity to take the next step in your career with this fast growing financial services business!,https://www.seek.co.nz/job/82073360?type=standard&ref=search-standalone&origin=cardTitle#sol=d03c89dde2df939bcaeed0d241667c068e55b689,20h ago,,,,,,2025-03-13,,Wellington,Quick Apply
Software Engineer – Mobile Apps - Android,TSB,"Develop and prepare mobile applications and code changes for deployment through testing and production environments, aligned to business needs.",https://www.seek.co.nz/job/82697618?type=standard&ref=search-standalone&origin=cardTitle#sol=86b1b52d304f218478d36c8b7c217f51b1e97eb2,8d ago,,,,,,2025-03-13,,Wellington,Apply
