title,company,description,link,listedOn,email,phone,city,region,salary,runDate,jobType,regionName,applyType
Full Stack Software Engineer (Senior or Intermediate),Aware Group,Join Aware to work on exciting cloud projects with cutting-edge technology and create award-winning data platform solutions for global clients.,https://www.seek.co.nz/job/82560951?type=standard&ref=search-standalone&origin=cardTitle#sol=35a52d420de1e86f261a00aba6d7abe0c86037e4,7d ago,,,,,Competitive,2025-03-13,,Wellington,Quick Apply
HEAD OF MARKETING & COMMUNICATIONS,Arotec Diagnostics Limited,"Join AROTEC Diagnostics Limited as our Head of Marketing & Communications and make a real, impact on patient outcomes worldwide.",https://www.seek.co.nz/job/82288300?type=standard&ref=search-standalone&origin=cardTitle#sol=73266fa3a9494e6488a8908744f86e0e55e6b1da,18d ago,,,,,"$132,417-$160,472 + Kiwisaver + Wellness Benefits",2025-03-13,,Wellington,Quick Apply
Front-end Developer,Potentia,"Work with a collaborative, cross functional team to build interactive web apps",https://www.seek.co.nz/job/82600816?type=standard&ref=search-standalone&origin=cardTitle#sol=01e72e72679e9c2a3b3745651a38f10549ee1430,6d ago,,,,,"$90,000 – $110,000 per year",2025-03-13,,Wellington,Quick Apply
Network Operations Engineer,Fusion Networks Ltd,"Join us as a Network Engineer, using top tools to ensure seamless connectivity and deliver exceptional service for our customers!",https://www.seek.co.nz/job/82112495?type=standard&ref=search-standalone&origin=cardTitle#sol=e28853e09795b017c9a7c0ce517fa8ab933f27c3,25d ago,,,,,NZD 140 - 160 per hour,2025-03-13,,Wellington,Quick Apply
Test Analyst,Catch Design,"Seeking a talented Test Analyst to join our team who thrives on ensuring high-quality, functional digital digital projects leave our agency.",https://www.seek.co.nz/job/82404300?type=standard&ref=search-standalone&origin=cardTitle#sol=b6dac4b0c478c7ca5c2e9f5fae4f61b837cd0a5c,14d ago,,,,,"90,000 - 110,000",2025-03-13,,Wellington,Quick Apply
Senior IT Project & Implementation Manager,Wētā FX Limited,"We are seeking a Senior PM to take responsibility for the delivery of complex projects that have a significant business, and high-profile impact.",https://www.seek.co.nz/job/82181394?type=standard&ref=search-standalone&origin=cardTitle#sol=94059486d7f2e16f77caac0b389dbd44b7c87fdb,23d ago,,,,,"Competitive salary, flexible working, cool mahi",2025-03-13,,Wellington,Quick Apply
Data Architect,Aware Group,Join our growing team of talented developers to work with emerging tech and create award-winning data platform solutions for global clients.,https://www.seek.co.nz/job/82482450?type=standard&ref=search-standalone&origin=cardTitle#sol=cd0a0c4985cdef0e4eafa87cbecc30250fd5fdc9,10d ago,,,,,Competitive salary and great benefits,2025-03-13,,Wellington,Quick Apply
Multiple Contract Java Developers,Comspek International Limited,Multiple Contracts - Want to be part of a delivery team who are leading the way with Open Banking and Enterprise APIs for our key banking...,https://www.seek.co.nz/job/82670067?type=standard&ref=search-standalone&origin=cardTitle#sol=d6c06336170c9ea8660b4554526abc5d2ceb36db,2d ago,,,,,$$ dependent on your experience,2025-03-13,,Wellington,Quick Apply
Product Marketing & Communications Manager,Convergence,"Take the lead on translating complex, technical product information into compelling, customer-focused communications.",https://www.seek.co.nz/job/82080986?type=standard&ref=search-standalone&origin=cardTitle#sol=3ff421f802c11623657fe79519f8cc35415e60fd,27d ago,,,,,"$145,986 - $171,748 plus 3% KiwiSaver",2025-03-13,,Wellington,Quick Apply
Senior Project Manager,"Ministry of Business, Innovation and Employment",Work in a dynamic environment and play a key role in delivering transformational change,https://www.seek.co.nz/job/82642138?type=standard&ref=search-standalone&origin=cardTitle#sol=121c6378668f34898fc892ceb8a9cafefc26605c,3d ago,,,,,,2025-03-13,,Wellington,Apply
Cyber Security Analyst/Penetration Tester,Liverton Security Limited,The successful applicant will have a fantastic opportunity to make a meaningful contribution to the future direction and growth of the business.,https://www.seek.co.nz/job/82214010?type=standard&ref=search-standalone&origin=cardTitle#sol=aa4125cad004a839369a2cbf7d4131734beac41d,22d ago,,,,,,2025-03-13,,Wellington,Quick Apply
Financial Systems Architect,Potentia,Exciting opportunity to architect and develop a world-first financial system in the growing PropTech industry.,https://www.seek.co.nz/job/82560868?type=standard&ref=search-standalone&origin=cardTitle#sol=c4fef93ec1596ff0da5ee8a1ae0c4c9f8cc335d2,7d ago,,,,,,2025-03-13,,Wellington,Quick Apply
"Deputy Chief Executive, Operations",INSIDE Recruitment,Lead transformational change in Aotearoa’s health and safety landscape,https://www.seek.co.nz/job/82566964?type=standard&ref=search-standalone&origin=cardTitle#sol=abd54cb4675e14d1244f99059a90fedf4f127272,7d ago,,,,,,2025-03-13,,Wellington,Quick Apply
IT Project Manager,H2R Technology Limited,Intermediate IT Project Management opportunity for a fast growing Saas organisation supporting infrastructure and security projects,https://www.seek.co.nz/job/82526946?type=standard&ref=search-standalone&origin=cardTitle#sol=46d6e5dfecd38efbbfe5752006665fbe0c10eda9,9d ago,,,,,,2025-03-13,,Wellington,Apply
Data Engineer (until Nov 2025),Contact Energy,Shape cutting-edge AI and Machine Learning solutions with an ambitious team on the path to decarbonising Aotearoa.,https://www.seek.co.nz/job/82731678?type=standard&ref=search-standalone&origin=cardTitle#sol=76895184aba7386c9a44cf7b09bb4d7d08f6404d,21h ago,,,,,,2025-03-13,,Wellington,Apply
Lead Software Engineer [Back-End] (Remote - NZ),TixTrack,"We are looking for a Lead Software Engineer to design, develop, and optimize strong back-end systems within our Ticketure product.",https://www.seek.co.nz/job/82624197?type=standard&ref=search-standalone&origin=cardTitle#sol=cbe4b66ac6fa258d338a28a46eb31e1df050592a,6d ago,,,,,,2025-03-13,,Wellington,Quick Apply
Trust Board Members,Star People,Exciting new opportunity to enable meaningful economic growth on the Kāpiti Coast - be part of shaping the future.,https://www.seek.co.nz/job/82593427?type=standard&ref=search-standalone&origin=cardTitle#sol=34268a911d46ee5a5e0156ce03aa085827d262c5,7d ago,,,,,,2025-03-13,,Wellington,Quick Apply
Project Manager,New Zealand Law Society,Seeking an experienced Project Manager to oversee end-to-end delivery on a variety of technology projects.,https://www.seek.co.nz/job/82641561?type=standard&ref=search-standalone&origin=cardTitle#sol=6368e22629696b66e515f18467f489b9a98e5d43,4d ago,,,,,,2025-03-13,,Wellington,Quick Apply
Principal Analyst / Principal Advisor - Data,Taska360,Ideally you have done some work with the likes of R but are now doing less hands on work & might be interested in strategic work or product mgmt work,https://www.seek.co.nz/job/82651639?type=standard&ref=search-standalone&origin=cardTitle#sol=a864313691b1b2f76cc83082030badc228a3f531,3d ago,,,,,,2025-03-13,,Wellington,Quick Apply
Principal Data Engineer,Commerce Commission,Lead the delivery of the technology and practices that will enable our data and analytics strategy.,https://www.seek.co.nz/job/82700424?type=standard&ref=search-standalone&origin=cardTitle#sol=e7875fa513ce2cef0e8f194beb3bec8c8aa295a6,1d ago,,,,,,2025-03-13,,Wellington,Apply
Marketing & Partnership Manager,Awanui Group,"Become part of a supportive and inclusive work environment that values the growth, work-life balance, and personal well-being of its employees.",https://www.seek.co.nz/job/82565076?type=standard&ref=search-standalone&origin=cardTitle#sol=a28ffa4aa5c608114202bc9c83e77a20eb36857a,7d ago,,,,,Competitive salary and great benefits,2025-03-13,,Wellington,Apply
General Manager Corporate,ATCL Search,"Drive financial sustainability, lead corporate excellence and make an impact in affordable housing.",https://www.seek.co.nz/job/82669935?type=standard&ref=search-standalone&origin=cardTitle#sol=8ef194d9ce7e7e12d4538efe4f45e72adbcf43f2,2d ago,,,,,$65000.00 - $75000.00 (AUD),2025-03-13,,Wellington,Quick Apply
Cyber Security Portfolio Manager,"Ministry of Business, Innovation and Employment",Discover a career with purpose at MBIE,https://www.seek.co.nz/job/82675252?type=standard&ref=search-standalone&origin=cardTitle#sol=e7d5fa59773a897a9046d1e8034ec79761393931,2d ago,,,,,$110 - $120 p.h. + Hourly rate + paid weekly,2025-03-13,,Wellington,Apply
Strategic Communications Lead – Fixed Term (2 Years),PowerNet,"If you’re a strategic thinker with a passion for communication and engagement, we want to hear from you!",https://www.seek.co.nz/job/82143831?type=standard&ref=search-standalone&origin=cardTitle#sol=981ef271a7f88b3af03f42cb3cc3148966642f94,23d ago,,,,,,2025-03-13,,Wellington,Apply
Business Analyst - Fixed term for 6 months,ASPEQ Limited,Be a member of a team that champions the customer’s needs.,https://www.seek.co.nz/job/82689778?type=standard&ref=search-standalone&origin=cardTitle#sol=d33f10a85fef58157057fa42de0b8cd3d4209690,2d ago,,,,,,2025-03-13,,Wellington,Quick Apply
Business Analyst,New Zealand Law Society,"Do you excel in a dynamic, technical project environment? This is the role for you!",https://www.seek.co.nz/job/82646771?type=standard&ref=search-standalone&origin=cardTitle#sol=71d4e6c63e2e388cab0007c15e9ca833a94c340f,3d ago,,,,,,2025-03-13,,Wellington,Quick Apply
Customer Experience Specialist,Beyond Recruitment - NZ’s best career opportunities – jobs all over Aotearoa,We are looking for an experienced CX focused Business Analyst to join a public sector organisation to 30th June 2025.,https://www.seek.co.nz/job/82700884?type=standard&ref=search-standalone&origin=cardTitle#sol=20b11d1e88c28e7eac972276bff33304a079a2c7,1d ago,,,,,,2025-03-13,,Wellington,Quick Apply
General Manager - Community & Facilities,Cricket Wellington,Are you a dynamic and strategic manager? Join us and lead our community cricket initiatives and oversee facility development in the Wellington region!,https://www.seek.co.nz/job/82391853?type=standard&ref=search-standalone&origin=cardTitle#sol=e7b0976c3aacaff4860a67680b485d5b6447a5ed,15d ago,,,,,,2025-03-13,,Wellington,Quick Apply
Technical Business Analyst,TEKsystems,Tech BA,https://www.seek.co.nz/job/82555630?type=standard&ref=search-standalone&origin=cardTitle#sol=fa82840d503616d70875c1049cbc10cfad6058c8,8d ago,,,,,,2025-03-13,,Wellington,Apply
Communications Advisor,JacksonStone & Partners,"Develop quality content, strengthen engagement with Māori & Pacific, and enhance relationships.",https://www.seek.co.nz/job/82535455?type=standard&ref=search-standalone&origin=cardTitle#sol=9b1b507015b3fb3ab1e5af9661bc21ae05e109f6,8d ago,,,,,,2025-03-13,,Wellington,Quick Apply
Intermediate Test Engineer (Manual and Automation),GS1 New Zealand,Craving a career-defining role with a genuinely purpose-driven organisation?,https://www.seek.co.nz/job/82181243?type=standard&ref=search-standalone&origin=cardTitle#sol=6df2660c100a136718e71a54f6d0788c86005348,23d ago,,,,,,2025-03-13,,Wellington,Quick Apply
Change Manager,Natural Hazards Commission - Toka Tū Ake,"Kaiwhakahaere Panoni About the role | Mo te mahi We are looking for an experienced Change Manager to join our Portfolio Planning and Change team on a",https://www.seek.co.nz/job/82673259?type=standard&ref=search-standalone&origin=cardTitle#sol=4b0848c176b371cb4700fdcfa5eb080203d8c231,2d ago,,,,,,2025-03-13,,Wellington,Apply
"Expression of Interest 2026 Graduate Programme - Science | Tonkin + Taylor",Tonkin & Taylor Ltd,Sign up here to express your interest in our 2026 Graduate Programme,https://www.seek.co.nz/job/82478517?type=standard&ref=search-standalone&origin=cardTitle#sol=ec47d8e805292b093458e2f4d515dda05e285c5d,10d ago,,,,,,2025-03-13,,Wellington,Apply
Tech Lead - Cloud Engineering,New Zealand Customs Service,Accountable for applying modern cloud engineering principles and practices within Customs.,https://www.seek.co.nz/job/82420709?type=standard&ref=search-standalone&origin=cardTitle#sol=891d78aff6bfd83a567256eb60694030ce2511b9,14d ago,,,,,,2025-03-13,,Wellington,Apply
Front End Developer,INSIDE Recruitment,Bring your React skills to the team and work on large scale solutions. Catered lunch provided 3 days every week.,https://www.seek.co.nz/job/82182345?type=standard&ref=search-standalone&origin=cardTitle#sol=2308253c0bc3c9be53fda31f401af9b8a9fc4481,23d ago,,,,,,2025-03-13,,Wellington,Quick Apply
GM Learning & Commercial,SWR Group NZ Limited,"A leader who can balance educational excellence with commercial acumen, sitting at the heart of the Senior Leadership Team.",https://www.seek.co.nz/job/82741769?type=standard&ref=search-standalone&origin=cardTitle#sol=6c5eebfbf520879cbd80c28236bfbd9b2919d4bb,17h ago,,,,,,2025-03-13,,Wellington,Quick Apply
Marketing Manager,Robert Walters,Our client is actively seeking a proven digital marketer and business leader to join their team in the role of Marketing Manager.,https://www.seek.co.nz/job/82402688?type=standard&ref=search-standalone&origin=cardTitle#sol=95a05f13514992f629704a699b2acb5c12e7426c,14d ago,,,,,,2025-03-13,,Wellington,Quick Apply
"Director, AI Strategy & Implementation",RNZ,"Lead the adoption of AI tools at RNZ, making sure they follow our ethical & journalistic standards while improving efficiency and audience engagement.",https://www.seek.co.nz/job/82643384?type=standard&ref=search-standalone&origin=cardTitle#sol=4591acd9b92720c6c963319adea65430ba98cef2,3d ago,,,,,,2025-03-13,,Wellington,Apply
Management Cadet,Taylor Preston Limited,This role will provide the cadet a clear career path to a management position within the Company or its subsidiaries and joint ventures.,https://www.seek.co.nz/job/82147576?type=standard&ref=search-standalone&origin=cardTitle#sol=a9dd4483ad6933b7213c144f497e6fd82f8dd72a,23d ago,,,,,,2025-03-13,,Wellington,Apply
.Net Developer,"UpperGround by Hudson - Technology, Projects & Transformation","Enhance and optimize public-facing websites and apps, driving continuous improvement with .NET & JavaScript in a flexible, high-impact contact role",https://www.seek.co.nz/job/82685704?type=standard&ref=search-standalone&origin=cardTitle#sol=b8f1764614a589e9726d2e10b898850bbfaf99f2,2d ago,,,,,,2025-03-13,,Wellington,Quick Apply
Senior Technical Specialist,"UpperGround by Hudson - Technology, Projects & Transformation","Bring your skills to modernise core systems including Exchange Online, Intune, Microsoft Defender, Microsoft Teams, and Windows 11.",https://www.seek.co.nz/job/82318685?type=standard&ref=search-standalone&origin=cardTitle#sol=5e45a480c3d780471f65cb9238abfd1f4637ff8d,17d ago,,,,,,2025-03-13,,Wellington,Quick Apply
Chief Executive Officer,Rothley,"We are seeking an experienced and established leader passionate about people and purpose, who has the commercial acumen and personal style to lead PNZ",https://www.seek.co.nz/job/82112473?type=standard&ref=search-standalone&origin=cardTitle#sol=d895b96816dac6584604901e8cc8b53d9f5e6437,25d ago,,,,,,2025-03-13,,Wellington,Quick Apply
Applications Developer,New Zealand Customs Service,"Got a passion for crafting and supporting resilient, adaptable systems in an evolving operating environment? Come join the team at NZ Customs!",https://www.seek.co.nz/job/82561464?type=promoted&ref=search-standalone&origin=cardTitle#sol=a1140bfcb326cb75ed3adde3757621cff8447e34,23d ago,,,,,Competitive salary - flexible working options,2025-03-13,,Wellington,Apply
Digital Solution Architect,Theta,"Holidays are over, you are feeling energetic and ready to make a career change - join a highly regarded, New Zealand-owned technology company.",https://www.seek.co.nz/job/82113017?type=promoted&ref=search-standalone&origin=cardTitle#sol=1f6db850b68b52fcff53fb57d837c23905f0830e,2d ago,,,,,"Medical Insurance, enhanced parental leave, etc.",2025-03-13,,Wellington,Quick Apply
Strategic Communications Lead – Fixed Term (2 Years),PowerNet,"If you’re a strategic thinker with a passion for communication and engagement, we want to hear from you!",https://www.seek.co.nz/job/82143831?type=standard&ref=search-standalone&origin=cardTitle#sol=1a08f7bdecfb5b9201c71cbb8a9ae94e76a6118a,3d ago,,,,,Competitive salary and great benefits,2025-03-13,,Wellington,Apply
Business Analyst - Fixed term for 6 months,ASPEQ Limited,Be a member of a team that champions the customer’s needs.,https://www.seek.co.nz/job/82689778?type=standard&ref=search-standalone&origin=cardTitle#sol=84ce680bd6f4561dc43129a82937031be1d75971,1d ago,,,,,$65000.00 - $75000.00 (AUD),2025-03-13,,Wellington,Quick Apply
Business Analyst,New Zealand Law Society,"Do you excel in a dynamic, technical project environment? This is the role for you!",https://www.seek.co.nz/job/82646771?type=standard&ref=search-standalone&origin=cardTitle#sol=8fe8d2ef46d11c2f6999af9cc99d4f3cd3c1b163,15d ago,,,,,$110 - $120 p.h. + Hourly rate + paid weekly,2025-03-13,,Wellington,Quick Apply
Customer Experience Specialist,Beyond Recruitment - NZ’s best career opportunities – jobs all over Aotearoa,We are looking for an experienced CX focused Business Analyst to join a public sector organisation to 30th June 2025.,https://www.seek.co.nz/job/82700884?type=standard&ref=search-standalone&origin=cardTitle#sol=8309790eb31ab04ed40dbe99de771b0a62252520,8d ago,,,,,,2025-03-13,,Wellington,Quick Apply
General Manager - Community & Facilities,Cricket Wellington,Are you a dynamic and strategic manager? Join us and lead our community cricket initiatives and oversee facility development in the Wellington region!,https://www.seek.co.nz/job/82391853?type=standard&ref=search-standalone&origin=cardTitle#sol=dcbf28848a289360699a70fc48c1ddf4e3c1a524,8d ago,,,,,,2025-03-13,,Wellington,Quick Apply
Technical Business Analyst,TEKsystems,Tech BA,https://www.seek.co.nz/job/82555630?type=standard&ref=search-standalone&origin=cardTitle#sol=751cb75b2606aa6e744500fc0b1c1d6ad8ceee73,23d ago,,,,,,2025-03-13,,Wellington,Apply
Communications Advisor,JacksonStone & Partners,"Develop quality content, strengthen engagement with Māori & Pacific, and enhance relationships.",https://www.seek.co.nz/job/82535455?type=standard&ref=search-standalone&origin=cardTitle#sol=76c4a9d68c0b70b0911d99a4b23139b38b4c9e9a,2d ago,,,,,,2025-03-13,,Wellington,Quick Apply
Intermediate Test Engineer (Manual and Automation),GS1 New Zealand,Craving a career-defining role with a genuinely purpose-driven organisation?,https://www.seek.co.nz/job/82181243?type=standard&ref=search-standalone&origin=cardTitle#sol=246bd8875805dd9c831a43ddaeee3c8d0cb148b5,10d ago,,,,,,2025-03-13,,Wellington,Quick Apply
Change Manager,Natural Hazards Commission - Toka Tū Ake,"Kaiwhakahaere Panoni About the role | Mo te mahi We are looking for an experienced Change Manager to join our Portfolio Planning and Change team on a",https://www.seek.co.nz/job/82673259?type=standard&ref=search-standalone&origin=cardTitle#sol=aac357782eff0f7f2ea1bde2be3c5fb876b8f9bd,14d ago,,,,,,2025-03-13,,Wellington,Apply
"Expression of Interest 2026 Graduate Programme - Science | Tonkin + Taylor",Tonkin & Taylor Ltd,Sign up here to express your interest in our 2026 Graduate Programme,https://www.seek.co.nz/job/82478517?type=standard&ref=search-standalone&origin=cardTitle#sol=72a88ceb39bbe53143426a8a7aeb17139ba4dde2,23d ago,,,,,,2025-03-13,,Wellington,Apply
Tech Lead - Cloud Engineering,New Zealand Customs Service,Accountable for applying modern cloud engineering principles and practices within Customs.,https://www.seek.co.nz/job/82420709?type=standard&ref=search-standalone&origin=cardTitle#sol=6ef4db38d9158da55e1ce9f6ad503bd017601a4f,17h ago,,,,,,2025-03-13,,Wellington,Apply
Front End Developer,INSIDE Recruitment,Bring your React skills to the team and work on large scale solutions. Catered lunch provided 3 days every week.,https://www.seek.co.nz/job/82182345?type=standard&ref=search-standalone&origin=cardTitle#sol=d0b088192f405e02e5ce8504c356678201dd6240,14d ago,,,,,,2025-03-13,,Wellington,Quick Apply
GM Learning & Commercial,SWR Group NZ Limited,"A leader who can balance educational excellence with commercial acumen, sitting at the heart of the Senior Leadership Team.",https://www.seek.co.nz/job/82741769?type=standard&ref=search-standalone&origin=cardTitle#sol=96fe79ab3e67c456d55a484c491420d766407ecc,3d ago,,,,,,2025-03-13,,Wellington,Quick Apply
Marketing Manager,Robert Walters,Our client is actively seeking a proven digital marketer and business leader to join their team in the role of Marketing Manager.,https://www.seek.co.nz/job/82402688?type=standard&ref=search-standalone&origin=cardTitle#sol=e9bc1c8e5206efb328aa35a7b3522fc5ae0b1e02,10d ago,,,,,,2025-03-13,,Wellington,Quick Apply
"Director, AI Strategy & Implementation",RNZ,"Lead the adoption of AI tools at RNZ, making sure they follow our ethical & journalistic standards while improving efficiency and audience engagement.",https://www.seek.co.nz/job/82643384?type=standard&ref=search-standalone&origin=cardTitle#sol=4cbe0b90f5ca0cc5a40db2a0d56fa7c9f492acd2,23d ago,,,,,,2025-03-13,,Wellington,Apply
Salesforce Project Manager,Seisma,"Oversee end-to-end Salesforce projects, from planning and execution to deployment and adoption.",https://www.seek.co.nz/job/82471404?type=standard&ref=search-standalone&origin=cardTitle#sol=fd164aa835604def80b6c442ffe7c95999824b07,2d ago,,,,,,2025-03-13,,Wellington,Quick Apply
Management Cadet,Taylor Preston Limited,This role will provide the cadet a clear career path to a management position within the Company or its subsidiaries and joint ventures.,https://www.seek.co.nz/job/82147576?type=standard&ref=search-standalone&origin=cardTitle#sol=dfc5d22819999749013dc6df29938c6acc5af5ff,17d ago,,,,,,2025-03-13,,Wellington,Apply
.Net Developer,"UpperGround by Hudson - Technology, Projects & Transformation","Enhance and optimize public-facing websites and apps, driving continuous improvement with .NET & JavaScript in a flexible, high-impact contact role",https://www.seek.co.nz/job/82685704?type=standard&ref=search-standalone&origin=cardTitle#sol=8d2bfbd225ddaa0ee0da3fcab422f8cde7e7393c,25d ago,,,,,,2025-03-13,,Wellington,Quick Apply
Senior Technical Specialist,"UpperGround by Hudson - Technology, Projects & Transformation","Bring your skills to modernise core systems including Exchange Online, Intune, Microsoft Defender, Microsoft Teams, and Windows 11.",https://www.seek.co.nz/job/82318685?type=standard&ref=search-standalone&origin=cardTitle#sol=c36b43763da616a9f6b0df2c8d87badae5787fca,,,,,,,2025-03-13,,Wellington,Quick Apply
Chief Executive Officer,Rothley,"We are seeking an experienced and established leader passionate about people and purpose, who has the commercial acumen and personal style to lead PNZ",https://www.seek.co.nz/job/82112473?type=standard&ref=search-standalone&origin=cardTitle#sol=47600346507189a8ca1125e6861473e6ea3987fc,,,,,,,2025-03-13,,Wellington,Quick Apply
Senior DevOps Engineer,New Zealand Customs Service,Dynamic and varied full-time permanent position on offer to join Customs as a Senior DevOps Engineer!,https://www.seek.co.nz/job/82473677?type=promoted&ref=search-standalone&origin=cardTitle#sol=75ff33023510e81f3455a4b0ef29582098b403ee,17d ago,,,,,"Medical Insurance, enhanced parental leave, etc.",2025-03-13,,Wellington,Apply
Digital Solution Architect,Theta,"Holidays are over, you are feeling energetic and ready to make a career change - join a highly regarded, New Zealand-owned technology company.",https://www.seek.co.nz/job/82113017?type=promoted&ref=search-standalone&origin=cardTitle#sol=b9b891b313f07827eaabac7e4418414a7dcc5c95,23d ago,,,,,Enjoy discounts across Star Group & more,2025-03-13,,Wellington,Quick Apply
Campaign Coordinator Loyalty,Star Group,Sink your teeth into this busy and versatile role with Star Group and be part of NZ’s leading hospitality group!,https://www.seek.co.nz/job/82296715?type=standard&ref=search-standalone&origin=cardTitle#sol=52f1c3be72d236b0e0fb1a2532036eafa93e6465,6d ago,,,,,Up to 140k,2025-03-13,,Wellington,Apply
Professional Services Consultant (Onboarding) - 6 months Contract,Datacom,Our Why Datacom works with organisations and communities across Australia and New Zealand to make a difference in people’s lives and help orga,https://www.seek.co.nz/job/82156293?type=standard&ref=search-standalone&origin=cardTitle#sol=6716477807ccf3de10827e6743618e6b60584740,8d ago,,,,,Dunedin Based Role,2025-03-13,,Wellington,Quick Apply
Professional Services Consultant 6 Months Contract (Smartly),Datacom,The Professional Services Consultant is responsible for the set-up and installation of Smartly’s software.,https://www.seek.co.nz/job/82600261?type=standard&ref=search-standalone&origin=cardTitle#sol=aa5963a8493ef3fed5932b2a37e439ea95b18c94,3d ago,,,,,"$117,734 - $146,513",2025-03-13,,Wellington,Quick Apply
Product Manager,Upper Echelon Limited,Product Manager,https://www.seek.co.nz/job/82530755?type=standard&ref=search-standalone&origin=cardTitle#sol=1f00dce56e6c21740daeea6cebbc0c8697f930f0,20d ago,,,,,Rate up to $130 p.h.,2025-03-13,,Wellington,Quick Apply
Solution Architect / Delivery Lead,Expert360,Print Service solution - POC - Service transformation - vendor management - Enterprise Infrastructure,https://www.seek.co.nz/job/82653577?type=standard&ref=search-standalone&origin=cardTitle#sol=457c60ad256d32da476cc406a2b64a7a29c50461,2d ago,,,,,,2025-03-13,,Wellington,Quick Apply
Software Developer,"Hays | Technology",The Senior Software Developer delivers technology solutions to support products and enhances software development practices and quality.,https://www.seek.co.nz/job/82246567?type=standard&ref=search-standalone&origin=cardTitle#sol=acac4b3732b42ef1746d6de71ed3f3f1712744d0,10d ago,,,,,,2025-03-13,,Wellington,Quick Apply
