title,company,description,link,listedOn,email,phone,city,region,salary,runDate,jobType,regionName,applyType
Mobile PC Technician and Consultant,Geeks on Wheels,Increase your IT knowledge on-the-job!,https://www.seek.co.nz/job/82335112?type=promoted&ref=search-standalone&origin=cardTitle#sol=4244b3a16fc785f9f01b706acd0c620de14a1ea4,22d ago,,,,,"$50,000 – $60,000 per year",2025-03-13,,Bay-of-Plenty,Quick Apply
R&D Operations Manager,Syos Aerospace Limited,Join Syos today and play a vital role in developing groundbreaking unmanned systems,https://www.seek.co.nz/job/82718665?type=promoted&ref=search-standalone&origin=cardTitle#sol=b31658498a51413b7f95f487d128a4c6fca03066,2d ago,,,,,"$65,000 – $80,000 per year",2025-03-13,,Bay-of-Plenty,Quick Apply
IT Systems Engineer,OneCall,Seeking a skilled IT Systems Engineer in Tauranga. MSP experience required. Strong M365 & Windows support expertise. Package includes car + phone.,https://www.seek.co.nz/job/82187697?type=standard&ref=search-standalone&origin=cardTitle#sol=d18ca1ea67707d152f4e4b29ac15fa4d692b2fe5,7d ago,,,,,"$65,000 – $85,000 per year",2025-03-13,,Bay-of-Plenty,Quick Apply
Field Technician,Awesome Technology Ltd,We are seeking a skilled and reliable Field Technician to join our team.,https://www.seek.co.nz/job/82674625?type=standard&ref=search-standalone&origin=cardTitle#sol=7ed9ad1bb7f6eb709a4b6aaa9dcd6cdaee6baf85,15d ago,,,,,"$60,000 – $75,000 per year",2025-03-13,,Bay-of-Plenty,Quick Apply
IT Manager,Comvita,"Contribute to IT initiatives that support a global brand, committed to environmental and social responsibility.",https://www.seek.co.nz/job/82562401?type=standard&ref=search-standalone&origin=cardTitle#sol=02efd32c67abc3542723f293efcf2359e5cd051e,10d ago,,,,,"$50,000 – $60,000 per year",2025-03-13,,Bay-of-Plenty,Apply
Digital Marketing Expert,Chuffed Gifts,"We need a Digital Marketing Expert to lead content creation, manage campaigns, and drive growth for a brand that is changing gifting in New Zealand.",https://www.seek.co.nz/job/82393490?type=standard&ref=search-standalone&origin=cardTitle#sol=81e1f8d1ce73c4f516deff60e8993459847f4520,17d ago,,,,,Competitive salary plus life and medical insurance,2025-03-13,,Bay-of-Plenty,Quick Apply
Desktop Support Engineer,OmniNet Ltd,Are you looking for more in IT? Join an innovative and collaborative IT company working with long standing customers across New Zealand. Read more,https://www.seek.co.nz/job/82492708?type=standard&ref=search-standalone&origin=cardTitle#sol=3e280703ffe7932a837e4f960f9c802a1f842abb,6d ago,,,,,,2025-03-13,,Bay-of-Plenty,Quick Apply
Customer Support Specialist,SwipedOn Ltd,"Awesome opportunity providing support and delivering an outstanding customer experience, ensuring our customers receive a world-class experience.",https://www.seek.co.nz/job/82290460?type=standard&ref=search-standalone&origin=cardTitle#sol=21db4b611ed28fbead01121e965f0961562f94fe,10d ago,,,,,,2025-03-13,,Bay-of-Plenty,Quick Apply
TV/AV & IT Installation Technician - Noel Leeming Rotorua,Noel Leeming,Get out on the road while working with an iconic brand!,https://www.seek.co.nz/job/82596556?type=standard&ref=search-standalone&origin=cardTitle#sol=f6994c0fb6ec6320d94278d2b47269fd81be3495,23d ago,,,,,,2025-03-13,,Bay-of-Plenty,Apply
L1/L2 Desktop Support Engineer (6-month Contract - Possible Extension)),CTRL Ltd,We're seeking a motivated and detail-oriented L1/L2 Desktop Support Engineer to join our team in Tauranga on a 6-month contract.,https://www.seek.co.nz/job/82468269?type=standard&ref=search-standalone&origin=cardTitle#sol=7bf794558f113cd44bfe51936e6d105f5e48dc4b,21d ago,,,,,,2025-03-13,,Bay-of-Plenty,Quick Apply
Data Analyst,Te Tāwharau o Te Whakatōhea,"Data drives our decisions. Unlock insights, drive impact! Join our team as a Data Analyst and transform data into actionable strategies.",https://www.seek.co.nz/job/82143150?type=standard&ref=search-standalone&origin=cardTitle#sol=bb6fe9b16affb85f680b5bc5b3620b5b1eb35c8c,1d ago,,,,,,2025-03-13,,Bay-of-Plenty,Quick Apply
ICT Support Technician - Tauranga,Desktop Technology Services Ltd,"Passionate about ICT Technician support and want to progress your career? Join our friendly, 100% NZ owned, nationwide team",https://www.seek.co.nz/job/82218320?type=standard&ref=search-standalone&origin=cardTitle#sol=03b030739a9c4d103f78e46e6d87162668aa74cf,10d ago,,,,,,2025-03-13,,Bay-of-Plenty,Apply
R&D Operations Manager,Syos Aerospace Limited,Join Syos today and play a vital role in developing groundbreaking unmanned systems,https://www.seek.co.nz/job/82718665?type=standard&ref=search-standalone&origin=cardTitle#sol=020f492ea5f5486c5d4a32b8fa13cf384b7b9915,16d ago,,,,,,2025-03-13,,Bay-of-Plenty,Quick Apply
Marketing Coordinator,Nduro Events,"This role is perfect for someone who thrives in a fast-paced, hands-on environment and loves turning creative ideas into action.",https://www.seek.co.nz/job/82472562?type=standard&ref=search-standalone&origin=cardTitle#sol=13efd928ef67eb9b719e13aa13b4c0345603bc33,9d ago,,,,,,2025-03-13,,Bay-of-Plenty,Quick Apply
Mobile PC Technician and Consultant,Geeks on Wheels,Increase your IT knowledge on-the-job!,https://www.seek.co.nz/job/82335112?type=standard&ref=search-standalone&origin=cardTitle#sol=b1e3f1408f63d45885b32d466caf9b75e3da0093,11d ago,,,,,,2025-03-13,,Bay-of-Plenty,Quick Apply
Head of Marketing and Communications,New Zealand Forest Research Ltd trading as Scion,"Lead a dynamic team of five to deliver marketing and communications, showcasing Scion’s Impactful research contributions to Aotearoa, New Zealand.",https://www.seek.co.nz/job/82526028?type=standard&ref=search-standalone&origin=cardTitle#sol=90af57d82ec774dca4ffe84ffb332e59b558fbe8,3d ago,,,,,,2025-03-13,,Bay-of-Plenty,Apply
GIS - Asset Data Technician,Powerco,"If you thrive in the upkeep of information and playing a role in keeping our customers safe, join us in our Asset information team.",https://www.seek.co.nz/job/82466297?type=standard&ref=search-standalone&origin=cardTitle#sol=1976d7a3958516506d53a9362e6ce5547b32e2f1,14d ago,,,,,,2025-03-13,,Bay-of-Plenty,Apply
Digital Analyst,The Conqueror Challenges,Great opportunity for an analyst with experience in writing web/app requirements to work on a product helping customers build a healthier lifestyle.,https://www.seek.co.nz/job/82667098?type=standard&ref=search-standalone&origin=cardTitle#sol=fe7d4dc8424d1709ec898559358917558d57f93e,2d ago,,,,,,2025-03-13,,Bay-of-Plenty,Quick Apply
General Manager,Geotechnics Ltd,"If you are a dynamic leader with a passion for the Heavy Transport and Mechanical Services industry, we would love to hear from you. Apply now!",https://www.seek.co.nz/job/82397694?type=standard&ref=search-standalone&origin=cardTitle#sol=9e9dcd52e407d345e10a457d94094340f07de061,8d ago,,,,,,2025-03-13,,Bay-of-Plenty,Quick Apply
Instrumentation and Telemetry (IoT) Technician – Tauranga,TREN Ltd,We are looking for an Intermediate Technician to join our team in Tauranga. This is a great opportunity for someone looking to get stuck into a career,https://www.seek.co.nz/job/82699588?type=standard&ref=search-standalone&origin=cardTitle#sol=9581e9e4e2e992566cebd1b9ef9bcdb148b66659,23d ago,,,,,,2025-03-13,,Bay-of-Plenty,Apply
Mid Level Graphic Designer & Digital Marketing Specialist,Abodo Wood Limited,We’re seeking a Mid Level Graphic Designer & Digital Specialist to join our fast-paced real estate team in Tauranga.,https://www.seek.co.nz/job/82529087?type=standard&ref=search-standalone&origin=cardTitle#sol=4fc91f7f677ba3192b1e6c0a81bf049f444acebd,,,,,,,2025-03-13,,Bay-of-Plenty,Quick Apply
Research and Development - Assistant,,Graduate role to use your degree in Chemistry or Mathematics to kickstart your career in R & D!,https://www.seek.co.nz/job/82181033?type=standard&ref=search-standalone&origin=cardTitle#sol=c4025f2c0ebe84c80aa68d649c740203dddce87a,,,,,,,2025-03-13,,Bay-of-Plenty,Quick Apply
GIS - Asset Data Technician,Powerco,"If you thrive in the upkeep of information and playing a role in keeping our customers safe, join us in our Asset information team.",https://www.seek.co.nz/job/82466297?type=promoted&ref=search-standalone&origin=cardTitle#sol=092519cee986cd1db2efaed270d1461658bcf086,20d ago,,,,,Competitive salary plus life and medical insurance,2025-03-13,,Bay-of-Plenty,Apply
Asphalt QA Technician,DOWNER NZ,Our Tauranga branch is looking for a critical thinker with an eye for detail and a passion for quality asphalt activities? Full Time Opportunity!,https://www.seek.co.nz/job/82180973?type=promoted&ref=search-standalone&origin=cardTitle#sol=03925655c0d4b73674cdeef1572c8dfd715a914f,20d ago,,,,,Competitive Pay + Penal Rates!,2025-03-13,,Bay-of-Plenty,Apply
General Manager,Komatsu Forest New Zealand Ltd,Lead an innovative forestry equipment provider and drive profitable growth. Competitive salary package with fully maintained company vehicle.,https://www.seek.co.nz/job/82246342?type=standard&ref=search-standalone&origin=cardTitle#sol=981029d8827101e67d419224e1b0777c59a712b5,3d ago,,,,,"$90,000 – $120,000 per year",2025-03-13,,Bay-of-Plenty,Quick Apply
Data & Insights Analyst - Power BI,Trimax Mowing Systems,Data-driven insights to support and shape business decisions. Interesting and varied work with interaction with a wide range of business users.,https://www.seek.co.nz/job/82250128?type=standard&ref=search-standalone&origin=cardTitle#sol=ef342c710917241ced28346652fb12996bd92b83,13d ago,,,,,Competitive Pay + Penal Rates!,2025-03-13,,Bay-of-Plenty,Quick Apply
Marketing Manager (Maternity Leave Cover),GEA New Zealand,GEA Farm Technologies New Zealand is looking for a Marketing Manager to cover maternity leave.,https://www.seek.co.nz/job/82643108?type=standard&ref=search-standalone&origin=cardTitle#sol=ec83961dfc12f1c2501be8245c36cccb73067426,6d ago,,,,,$ Dependent on experience & background,2025-03-13,,Bay-of-Plenty,Quick Apply
Chief Financial Officer,Robert Walters,"Genera is an innovative, family-owned business and the market leader in sustainable biosecurity solutions across New Zealand and Australia.",https://www.seek.co.nz/job/82433716?type=standard&ref=search-standalone&origin=cardTitle#sol=2f2b605e82e875e5c43e03eb1e180206ce885010,25d ago,,,,,"$90,000 – $100,000 per year",2025-03-13,,Bay-of-Plenty,Quick Apply
Full-Stack Developer,Interpine Group Ltd,"Due to ever expanding workloads we are looking for a Full-Stack Developer to join the Interpine team, based in Rotorua.",https://www.seek.co.nz/job/82594480?type=standard&ref=search-standalone&origin=cardTitle#sol=c54fcc52e2b2cbef94a0e56e0df04fd7f57b9117,23d ago,,,,,"$90,000 – $130,000 per year",2025-03-13,,Bay-of-Plenty,Quick Apply
Process Chemist,Winstone Wallboards,A role and environment where we are committed to excellence in manufacturing and innovation!,https://www.seek.co.nz/job/82111617?type=standard&ref=search-standalone&origin=cardTitle#sol=5da2334aa860300bf168ac8ebe68c71adae523e9,14d ago,,,,,,2025-03-13,,Bay-of-Plenty,Apply
Asphalt QA Technician,DOWNER NZ,Our Tauranga branch is looking for a critical thinker with an eye for detail and a passion for quality asphalt activities? Full Time Opportunity!,https://www.seek.co.nz/job/82180973?type=standard&ref=search-standalone&origin=cardTitle#sol=f1e94d5367fcc0ed11f03dbcc09100052ec4c0e8,9d ago,,,,,,2025-03-13,,Bay-of-Plenty,Apply
Marketing Coordinator,Personnel Resources,"Join a dynamic team and make an impact by implementing creative marketing campaigns, promoting training programs, and collaborating on exciting init",https://www.seek.co.nz/job/82420739?type=standard&ref=search-standalone&origin=cardTitle#sol=368ead5526de6ee49b68e6af05321773d172bfee,8d ago,,,,,,2025-03-13,,Bay-of-Plenty,Quick Apply
GENERAL MANAGER - MAKETŪ PIES,Montana Group,"Lead a talented team, drive strategy and business development, improve processes, and help shape the future of our pie production and brand.",https://www.seek.co.nz/job/82495419?type=standard&ref=search-standalone&origin=cardTitle#sol=b26ff1c948feceabb6cd77c46909696bd0e88874,17d ago,,,,,,2025-03-13,,Bay-of-Plenty,Quick Apply
Ecommerce Coordinator,Wide Open Distributors,"Join Wide Open as an Ecommerce Coordinator! Manage websites, drive marketing, and grow top cycling and snow brands in a creative part-time role.",https://www.seek.co.nz/job/82527331?type=standard&ref=search-standalone&origin=cardTitle#sol=d00e862bc9617566fc7850a3e938043016c52a35,2d ago,,,,,,2025-03-13,,Bay-of-Plenty,Quick Apply
Marketing and Sales Manager,Maimoa Creative Ltd,"Be part of a brand that is passionate about the revitalisation of te reo Māori. Lead marketing strategies, drive brand growth, and manage sales.",https://www.seek.co.nz/job/82291374?type=standard&ref=search-standalone&origin=cardTitle#sol=3f4905c6dbe046d33f3e85f1f5fc60957b59e839,9d ago,,,,,,2025-03-13,,Bay-of-Plenty,Quick Apply
Senior Software Engineer,Tauranga City Council,Join a diverse fun team and be our Senior responsible for the continuous improvement of code development practices within Council,https://www.seek.co.nz/job/82674510?type=standard&ref=search-standalone&origin=cardTitle#sol=0f33fa41223d1789a84b49514058f226e8a52043,1mo ago,,,,,,2025-03-13,,Bay-of-Plenty,Apply
RF and Network System Integration Engineer,Syos Aerospace Limited,"We are seeking a talented RF & Network System Integration Engineer, responsible for the end-to-end integration & testing of RF and network systems.",https://www.seek.co.nz/job/82513742?type=standard&ref=search-standalone&origin=cardTitle#sol=be23fbd8cc44856ddb4756a5755345684a9bb56f,14d ago,,,,,,2025-03-13,,Bay-of-Plenty,Quick Apply
General Manager - Post Harvest,Just Avocados Ltd,"Lead dynamic post-harvest teams, drive operational excellence and efficiencies across the Darling Group.",https://www.seek.co.nz/job/82046440?type=standard&ref=search-standalone&origin=cardTitle#sol=586d08c3306cf9076c0a62f36d88bfb59e720d60,13d ago,,,,,,2025-03-13,,Bay-of-Plenty,Quick Apply
General Manager - Pullman Rotorua,Accor Hotels NZ,"Pullman Rotorua, a 5-star hotel in one of New Zealand’s most iconic destinations, is looking for a visionary General Manager to lead our team!",https://www.seek.co.nz/job/82421046?type=standard&ref=search-standalone&origin=cardTitle#sol=1003c2c8f46eef6939d9e630809c8d604add6223,21d ago,,,,,,2025-03-13,,Bay-of-Plenty,Apply
Data Architect,Te Tāwharau o Te Whakatōhea,Design and build cutting-edge architecture to unlock the power of data to drive transformative change in a dynamic Māori organisation. APPLY NOW!,https://www.seek.co.nz/job/82429874?type=standard&ref=search-standalone&origin=cardTitle#sol=9e8abbe20599e78e8009e09a165ce2f1b7a76d60,16d ago,,,,,,2025-03-13,,Bay-of-Plenty,Quick Apply
Business Analyst,Techspace Consulting Limited,"Seeking a BA with 1-3 years' experience to gain hands-on exposure in a fast-paced, industry-leading organization",https://www.seek.co.nz/job/82223924?type=standard&ref=search-standalone&origin=cardTitle#sol=d73ae3b5a27f366405b04456f28770a66fb05a95,23d ago,,,,,,2025-03-13,,Bay-of-Plenty,Quick Apply
Media and Commmunications Co-ordinator,Te Puna Ora o Mataatua,Are you passionate about working in a dynamic environment that promotes innovation? Do you have a flair for creativity ? We want to hear from you!,https://www.seek.co.nz/job/82333385?type=standard&ref=search-standalone&origin=cardTitle#sol=04c3cdfc239f8c250721eca22703911903008369,3d ago,,,,,,2025-03-13,,Bay-of-Plenty,Quick Apply
Quality Assurance & Technical Manager,Montana Group,"Lead a talented small team, drive innovation, improve processes, and help shape the future of our pie production.",https://www.seek.co.nz/job/82145231?type=standard&ref=search-standalone&origin=cardTitle#sol=54ba7e7897a83f9fe56685c09bea6223f9960b52,,,,,,,2025-03-13,,Bay-of-Plenty,Quick Apply
Village Manager,Omokoroa Country Club,"We are seeking a Village Manager to lead our community, ensuring our residents always receive the highest standard of care, comfort, and lifestyle.",https://www.seek.co.nz/job/82668043?type=standard&ref=search-standalone&origin=cardTitle#sol=e6f53fd0f7db167698318722e795333cb133fed3,,,,,,,2025-03-13,,Bay-of-Plenty,Quick Apply
Chief Financial Officer,Robert Walters,"Genera is an innovative, family-owned business and the market leader in sustainable biosecurity solutions across New Zealand and Australia.",https://www.seek.co.nz/job/82433716?type=promoted&ref=search-standalone&origin=cardTitle#sol=16876562b736a3834719fe24373e99a2ef6c9bb2,6d ago,,,,,$Dependent on experience and background.,2025-03-13,,Bay-of-Plenty,Quick Apply
General Manager - Post Harvest,Just Avocados Ltd,"Lead dynamic post-harvest teams, drive operational excellence and efficiencies across the Darling Group.",https://www.seek.co.nz/job/82046440?type=promoted&ref=search-standalone&origin=cardTitle#sol=c7f1250858ea46705c6575bec04046b1bcaafbd1,27d ago,,,,,Flexible working options + a 9-day fortnight,2025-03-13,,Bay-of-Plenty,Quick Apply
Embedded Software Engineer - Aerospace,Syos Aerospace Limited,"Join us at Syos to be part of a rapidly expanding, innovative company at the forefront of the autonomous vehicle revolution.",https://www.seek.co.nz/job/82624944?type=standard&ref=search-standalone&origin=cardTitle#sol=de41297cde8a47ce41bdaf1377b0e498fe8f9799,18h ago,,,,,$110 - $130K,2025-03-13,,Bay-of-Plenty,Quick Apply
Event Coordinator (Parental Leave Cover),Trinity Wharf Tauranga,Join our busy events team at Tauranga's premium hotel & conference venue!,https://www.seek.co.nz/job/82069867?type=standard&ref=search-standalone&origin=cardTitle#sol=9c2432676c5819fc3c7380f8475007dc9692c24e,23d ago,,,,,,2025-03-13,,Bay-of-Plenty,Quick Apply
Senior Geospatial Information Systems Officer,Personnel Resources,Our client is looking for a passionate Senior Geospatial Information Systems Officer to join their team!,https://www.seek.co.nz/job/82740042?type=standard&ref=search-standalone&origin=cardTitle#sol=a3521c55a08a5e3766abc0f81c8ec901e472fd66,10d ago,,,,,,2025-03-13,,Bay-of-Plenty,Quick Apply
Business Analyst Lead,Techspace Consulting Limited,"To provide hands-on analysis, lead a team of 4, drive process improvements, and deliver strategic business solutions",https://www.seek.co.nz/job/82146962?type=standard&ref=search-standalone&origin=cardTitle#sol=082672a2b2471a39355110ccc7d76a9525e6c7fb,15d ago,,,,,,2025-03-13,,Bay-of-Plenty,Quick Apply
Data Architect & ML Lead,Cucumber Limited,"Lead big data architecture, MLOps, and data management solutions. Build scalable, impactful systems for real-world challenges.",https://www.seek.co.nz/job/82475984?type=standard&ref=search-standalone&origin=cardTitle#sol=d61c4895d637e45ba351b82cd245d47edad8b6ed,27d ago,,,,,,2025-03-13,,Bay-of-Plenty,Quick Apply
Research Investment Advisor,New Zealand Forest Research Ltd trading as Scion,"Provide research funding expertise, facilitate effective funding practice, support Scientists in securing funding, maximising the impact of research.",https://www.seek.co.nz/job/82392447?type=standard&ref=search-standalone&origin=cardTitle#sol=93b81eff677e7882a2025cf20b6394eb69c8dbaf,23d ago,,,,,,2025-03-13,,Bay-of-Plenty,Apply
Network Consultant,Absolute IT Limited,"Fortinet Guru needed! Lead network security. Expert knowledge of FortiGate, SD-WAN, VPN, Security Fabric, FortiAnalyzer required.",https://www.seek.co.nz/job/82075712?type=standard&ref=search-standalone&origin=cardTitle#sol=f2bd4ccdbbc62d4d44ad468b721aaf1359f9510c,,,,,,,2025-03-13,,Bay-of-Plenty,Quick Apply
Senior Business Analyst,Techspace Consulting Limited,"Drive process improvements, analyze business needs, and mentor junior analysts while ensuring high-quality BA deliverables",https://www.seek.co.nz/job/82147315?type=standard&ref=search-standalone&origin=cardTitle#sol=c55139fbd6ff5de7f7aabbeb9feaf0e7fd7808e8,,,,,,,2025-03-13,,Bay-of-Plenty,Quick Apply
Service Management - Product Specialist,Process Panda,Do you enjoy challenging work? Are you interested in building technical solutions that empower customers to better IT Service Management practices?,https://www.seek.co.nz/job/82686424?type=promoted&ref=search-standalone&origin=cardTitle#sol=2881f639f8c1fe6f88396b99f74bddc7530551d1,16d ago,,,,,"$115,000 – $135,000 per year",2025-03-13,,Wellington,Quick Apply
Senior Calibration Technician,ESR,We have a permanent part-time opportunity (0.6FTE) for a Senior Technician to calibrate a range of laboratory equipment.,https://www.seek.co.nz/job/82735117?type=promoted&ref=search-standalone&origin=cardTitle#sol=e2e06dd6187edd060c31049fb5b8804e7d88b9d2,18h ago,,,,,$55 – $83 per hour,2025-03-13,,Wellington,Apply
Remote Data Entry - Math Expert,Outlier,"This freelance opportunity is remote and hours are flexible, so you can work whenever is best for you",https://www.seek.co.nz/job/82357786?type=standard&ref=search-standalone&origin=cardTitle#sol=d251a7663e89ea6cab8d28b8e5b03bd36c2a2423,37m ago,,,,,"$74,588 - $87,019 (including 4% superannuation)",2025-03-13,,Wellington,Apply
IT Systems Engineer,Open Star Technologies,"As an IT Systems Engineer, you will be pivotal in shaping, maintaining and improving the technology infrastructure that supports OpenStar's mission.",https://www.seek.co.nz/job/82740429?type=standard&ref=search-standalone&origin=cardTitle#sol=976f1b9cb42ba88d581082f1f2261177ef3b46a6,1h ago,,,,,Competitive salary and great team benefits,2025-03-13,,Wellington,Quick Apply
IT Operations and Service Manager,H2R Technology Limited,Join a NZ wide known brand to manage the delivery and growth of the IT Operations team,https://www.seek.co.nz/job/82759180?type=standard&ref=search-standalone&origin=cardTitle#sol=b47bb0b0b32ed87efe735889f726813ab21dd415,20h ago,,,,,"$115,000 – $135,000 per year",2025-03-13,,Wellington,Apply
Systems Support Lead,Summerset,A great opportunity to join the property team at Summerset. Bring your administrative & analytical skills to a high performing team!,https://www.seek.co.nz/job/82758562?type=standard&ref=search-standalone&origin=cardTitle#sol=88a9d5f77c72e9f57240cba54663cd06398d649c,1mo ago,,,,,"$60,000 – $65,000 per year, pro rata basis",2025-03-13,,Wellington,Apply
IT User Support Specialist - NIWA,NIWA,"What you will be doing: This is a fixed-term opportunity that will allow you to experience a wide variety of IT systems, services, and activities as y",https://www.seek.co.nz/job/82735838?type=standard&ref=search-standalone&origin=cardTitle#sol=86a92e1d8643f8988a0776fd1c54ad3367b47ca5,3d ago,,,,,$25 per hour,2025-03-13,,Wellington,Apply
IT Support & Systems Administrator (New Zealand),Optimal Workshop,"As the go-to person for all things IT, you'll handle everything from company systems, supporting our employees globally, and security compliance.",https://www.seek.co.nz/job/82012717?type=standard&ref=search-standalone&origin=cardTitle#sol=33d26e65de9c634b7b11e3408b95321e9a03fecc,3d ago,,,,,"$138,093 - $152,629",2025-03-13,,Wellington,Quick Apply
Corporate Systems Administrator,"New Zealand Defence Force | Te Ope Kātua o Aotearoa",Maintain the NZDF Corporate Codification System and keep logistics data current.,https://www.seek.co.nz/job/82647454?type=standard&ref=search-standalone&origin=cardTitle#sol=1c2c2384b06bb862f9b2b828b06342013ebf91f2,3d ago,,,,,"$75,000 – $85,000 per year",2025-03-13,,Wellington,Apply
On-site Support Engineer L1/L2,Cyclone,"Work with a diverse range of technologies, from tailored education software to Enterprise cloud services, our Onsite Engineers play a pivotal role.",https://www.seek.co.nz/job/82667102?type=standard&ref=search-standalone&origin=cardTitle#sol=1e687f4a522043da52c1a13a90b59c01163472e9,1d ago,,,,,Up to $90k base salary,2025-03-13,,Wellington,Quick Apply
Cloud Support Engineer,BrightSpark Recruitment,"Work with cutting-edge cloud technologies, during an exciting phase of growth.",https://www.seek.co.nz/job/82643887?type=standard&ref=search-standalone&origin=cardTitle#sol=c2511eec5018b2f9a1261d9978fe6a69b509b207,22h ago,,,,,,2025-03-13,,Wellington,Quick Apply
Service Management - Product Specialist,Process Panda,Do you enjoy challenging work? Are you interested in building technical solutions that empower customers to better IT Service Management practices?,https://www.seek.co.nz/job/82686424?type=standard&ref=search-standalone&origin=cardTitle#sol=915a5699face12e4bf0b394d6c4c23b2532a8c19,4d ago,,,,,,2025-03-13,,Wellington,Quick Apply
DIGITAL CONTENT COORDINATOR,Samuel Marsden Collegiate School,Marsden is a leading independent school for girls in Wellington.,https://www.seek.co.nz/job/82731398?type=standard&ref=search-standalone&origin=cardTitle#sol=870ca24d160dcc267e15b35fedc95c37f5792a32,23d ago,,,,,,2025-03-13,,Wellington,Quick Apply
Sponsorship and Marketing Coordinator,Wellington Culinary Events Trust,Be part of two iconic Wellington festivals - Visa Wellington On a Plate and Beervana,https://www.seek.co.nz/job/82641283?type=standard&ref=search-standalone&origin=cardTitle#sol=2fde6183de19e30e4da1bc327419e8defda4b391,19h ago,,,,,,2025-03-13,,Wellington,Quick Apply
Brand Manager,Whittaker's,Unique opportunity for an exceptional brand professional to join New Zealand’s biggest chocolate manufacturer!,https://www.seek.co.nz/job/82147644?type=standard&ref=search-standalone&origin=cardTitle#sol=784d3d3a05719b190a5cb7ac09194528db543d98,16m ago,,,,,,2025-03-13,,Wellington,Quick Apply
Communications Intern,Silvereye Communications,Looking for an Intern to join our team for. This position is perfect for a university student looking to gain hands-on experience in a PR environment.,https://www.seek.co.nz/job/82738030?type=standard&ref=search-standalone&origin=cardTitle#sol=7afaebe57aed5cc083f9bc83076de2165df6ab76,2h ago,,,,,,2025-03-13,,Wellington,Quick Apply
